STATE,DISTRICT,Storage name,Address,Manager Name,capacity,Longitude,Latitude
Maharashtra,Thane,Ms Krushi Foods And Spices Private Limited,MIDC T T C Industrial Area Khairane Distt Thane,Shri Rajesh Mohandas Purswani,2400,73.01875849999999,19.0937817
Nagaland,Dimapur,Dimapur,"Khermahal,Opp. Naga Cemetery,Dimapur,Nagaland-797112",R K Boro,13000,93.642048,25.7358504
Odisha,Balangir,Ms Shreeya Cold Storage,Katarkala Bolangir,Shri Ramesh Jain,5000,83.4846069,20.7011108
Odisha,Ganjam,Jagarnath Cold Storage,"RAJA SAHI CHHAK,ASKA ROAD",Jn Murty,5000,-84.2758309,34.8044061
Odisha,Jharsuguda,Sri Sankar C S,PLOT.2028.BEHERAMAL.,Rambinay Prasad Shah,1700,83.8022149,21.720274
Odisha,Mayurbhanj,KichakezwariCold And Ice Store,KUDUMA-RASUNTALA-KARANJIA,Bidyadhar-Sutar,6000,86.0178972,21.763667
Odisha,Mayurbhanj,Malawi Agri C.S.,MOSQUITOES.WARD NO 12.KARANJIA,Pawan Agarwala,4000,85.9738752,21.7633498
Odisha,Mayurbhanj,Tarini Cold Storage,SANDEILI KARANJIA,Mangaluram,6000,85.9738752,21.7633498
Odisha,Puri,Mcs Andmcs,AT/PO-NIMAPARA,Swadhin,2700,86.0070547,20.0536724
Odisha,Sambalpur,K C Cold Storage,Jagannath Mandir Colony Budharaja Sambalpur,Shri Kailash Ch Agrawal,5000,83.984633,21.4808175
Odisha,Sambalpur,Shyam Cold Storage Expansion,Cold Storage Complex Baraipalli Distt Sambalpur,Shri Saket Pansari,100,83.9625195,21.4931147
Odisha,Sambalpur,Syam C.S.,BARAIPALI. SAMBALPUR,Saransh Pansari,4,83.9625195,21.4931147
Odisha,Sundargarh,MS Bharat Ice And Cold Storage Modernization,E3 E4 Industrial Area Rourkeal Dist Sundargarh,Shri Nirmal Chandar Routray,500,84.8535844,22.260423
Punjab,Amritsar,Joshan Agroo Food Cold Store,AKAL GADHA AMRITSAR,Jagjeet Singh,5777,74.8754214,31.620631
Punjab,Amritsar,Marwaha Cold Storage,FOCAL POINT PLOT 354 AMRITSAR,Rajinder Singh,2150,74.9143218,31.615163
Punjab,Amritsar,Ms A K Cold Store,Village Ibban Kalan Chabal Road Amritsar,Shri Sukhdev Singh,2240,74.8554269,31.6150379
Punjab,Amritsar,Ms Handa Cold Storage,VPO Tangra The Baba Bakala District Amritsar,Shri Ratan Lal,4935,75.12094280000001,31.5630764
Punjab,Amritsar,Ms Heir Cold Storage,Village Rakh Devidasspura Tehsil District Amritsar,Shri Jasmeir Singh,3472,75.298943,31.6466526
Punjab,Amritsar,Ms Satgur Cold Storage,VPO Muchhal District Amritsar,Shri S Ram Singh,3044,75.1443226,31.5698798
Punjab,Amritsar,Ms Thind Cold Storage Private Ltd GT Road Amritsar,Village Mana Walan Kala GT Road Amritsar Punjab,Shri Malkit Singh,1641,74.8722642,31.6339793
Punjab,Amritsar,Saha Cold Storage,MEHTA ROAD AMRITSAR,Vasudev,3840,74.9180824,31.6248563
Punjab,Bathinda,ANIL Cold Storage PVT LTD,RAMPURA FUL BHATINDA ROAD BATINDA,BHOLA SINGH,5900,75.2447754,30.2626376
Punjab,Bathinda,Bhawani (Sandhu) Cold Storage,MALOUT ROAD NEAR BEHMAN DIWANA VILLAGE,Aldel Singh,3500,74.85217519999999,30.2206404
Punjab,Bathinda,Guru Nanak Cold Store,BIBI WALA CHOWK,Baldav Singh,1440,74.9616297,30.2256072
Punjab,Bathinda,KISHAN Cold STORE,RAMPURA FUL LUDHIANA ROAD BHATINDA,RAKESH &KULJEET SINGH,6500,74.9454745,30.210994
Punjab,Bathinda,Ms Singla Cold Storage,Distt Bhatinda,Smt Seema Singla,4318,74.9454745,30.210994
Punjab,Bathinda,ONKARE Cold STORE,RAMPURA FULL BERNALA ROAD BHATINDA,Sukhvinder Singh,2000,75.5691784,30.5252454
Punjab,Bathinda,P B Cold Store,BARNALA ROAD RAMPURA FULLA DIST BHATINDA,Dinesh Gindhal,6,74.9454745,30.210994
Punjab,Bathinda,SANDEEP Cold Storage,LEHRA BEGA RAMPUR ROAD BHATINDA,VIJAY KUMAR,2400,75.12097039999999,30.2463671
Punjab,Bathinda,Take Cold Store,PHOL ROAD RAMPURAPHOL,Inderjeet Singh,5000,75.2398001,30.2701304
Punjab,Hoshiarpur,Ms Barfani Cold Storage,Focal Point Phagwara Road Hosinarpur,Shri Sanjeev Kumar,750,75.8991271,31.5111628
Punjab,Hoshiarpur,Ms S S Bajwa Cold Storage And Ice Factory,Purhiran Ring Road Hoshiarpur,Shri Dav Singh Bajwa,4328,75.88970290000002,31.4992938
Punjab,Hoshiarpur,Ms SBS Cold Storage,Village Ahirana PO Ahiran Kalan District Hoshiarpur,Shri S Gurmeet Singh,5201,75.8359645,31.4219239
Punjab,Hoshiarpur,Ms Shri Krishan Cold Storage,Village Gigan Wala Distt Hoshiarpur,Shri Sarabjit Singh,2796,75.911483,31.5143178
Punjab,Jalandhar,A.S. Kang Cold Storage,KARTARPUR ROAD,Shyamlal Ji,2083,75.0074493,32.1107589
Punjab,Jalandhar,Ashirward Cold Store,JANDE SARAYE ROAD KARTARPUR,Ashish Agarwal,4700,75.5030211,31.4439874
Punjab,Jalandhar,BHULLAR Cold STORE,NAKODAR ROAD JALANDHAR,JASPAL SINGH,2750,75.5176878,31.2301472
Punjab,Jalandhar,Begal Cold Storage,JANDE SARAYE ROAD KARTARPUR,Charanjeet Singh,2000,75.5030211,31.4439874
Punjab,Jalandhar,Chacha Cold Store,VILLAGE MAND,Subash Chander,6250,75.5000081,31.35158539999999
Punjab,Jalandhar,Dhaliwal Cold Storage,"SHAKOT ROAD MALSHIYA,DISTT.JALANDHAR",Roshanlal Ji,5,75.5742467,31.218722
Punjab,Jalandhar,Dheeraj Cold Storage,VILL.AADI KOUIE MAND ROAD JALANDHAR,Borjar Singh,4218,75.4978836,31.3514265
Punjab,Jalandhar,Friends Cold Store Agri Farms,Village Rahimpur Teh Nakodar District Jalandhar,Shri Akash Joshi,3117,75.4140844,31.2343929
Punjab,Jalandhar,G.FColdstorbabupurjalandhar,G.FCOLDSTORBABUPURJALANDHAR,Kamaljeetsingh,3500,75.57618289999999,31.3260152
Punjab,Jalandhar,G.S. Cold Storage,"GS COLD STORAGE ,AGRI FARM , VILLAGE-PRATAPPURA JA",Gurdeep Singh,1700,75.7331514,26.6136611
Punjab,Jalandhar,GOVIND Cold STORE,VILLAGE CHOKAN DIST. JALANDHAR,CHOTU RAM JANWAL,2500,75.57618289999999,31.3260152
Punjab,Jalandhar,GOVIND Cold STORE,VILL USMANPURE POST KHAMBRA,PARMOD KUMAR,2700,75.5575099,31.2735195
Punjab,Jalandhar,Gill Cold Storage,"VILL.SARMASTPUR,KISHANGARH ROAD G.T.ROAD JALANDHAR",Ghyanchand Ji,3335,76.86715,30.1411003
Punjab,Jalandhar,Guru Govind Singh Cold Storage,"GURU GOVIND COLD STORAGE V.P.O.-JAGAN,TH.-JALANDHA",Surendar Patial,3500,75.57618289999999,31.3260152
Punjab,Jalandhar,Guru Nanak Cold Storage,GURU NANAK COLD storageE BAJWA KALA MOGA ROAD SHAHK,Surendar Kumar,2230,75.17344709999999,30.8230114
Punjab,Jalandhar,Gurunanak Cold Store,NAKODAR ROAD,Hindpal Singh,2230,75.4824998,30.9687462
Punjab,Jalandhar,HIMALYA Cold STORE,VILLAGE.GAZIPUR,RAMESH CHAND,4000,90.3877184,23.9905079
Punjab,Jalandhar,Hazara Cold Store,HOSIYARPUR ROAD HAZARA,Suka Singh,4000,75.606869,31.3497999
Punjab,Jalandhar,Hindal Cold Storage,"VILL.WARIANA ,V.P.O.NAGRA,DISTT.JALANDHAR",Dharmendar Singh,4548,75.5742467,31.218722
Punjab,Jalandhar,J.S. Cold Storage & Farm,JSFARMS[At]YMAIL[Dot]COM,Sandeep Bhatia,2800,-93.311149,45.1950417
Punjab,Jalandhar,Jammu Cold Storage,"JANDAY SARAI ROAD VLL,BARA PIND KARTARPUR JALANDHA",Ravisher Singh,2000,75.52582550000001,31.4863828
Punjab,Jalandhar,Janta Cold Storage,BIKANER NAMKEEN BHANDAR MITHAPUR ROAD JALANDHAR,Sangram Singh,2800,75.57618289999999,31.3260152
Punjab,Jalandhar,Josan Cold Storage Pvt Ltd,JOSAN COLD storageE PVT LTD BUDNUWAL SHAHKOT,Jaswinder Singh,4600,75.3383027,31.0823586
Punjab,Jalandhar,K S Bal Cold Storage,Village Sehijhangi P O Gakhal Distt Jalandhar,S Gurkirpal Singh,5824,75.5131439,31.3088645
Punjab,Jalandhar,KAKKAR Cold STORE,G.T ROAD JALANDHAR,SATENDER SINGH,4724,75.5720003,31.3293063
Punjab,Jalandhar,KAPSON Cold Storage,BIDHIPUR,DHARMINDER KUMAR,5000,75.1990407,31.3005617
Punjab,Jalandhar,Kalsa Cold Store,MALSIYAN,Kamlesh Kumar,3500,75.3492342,31.1291515
Punjab,Jalandhar,Kartar Cold Store,MALSIAN,Ramesh Kumar,3500,75.3492342,31.1291515
Punjab,Jalandhar,Kartarpur Cold Storage,KARTARPUR ROAD,Kartar Singh Ji,3,75.0074493,32.1107589
Punjab,Jalandhar,Khalsha Cold Storage,JALANDHAR NIKODA ROAD BADSHAPUR,Raman Kumar,3250,75.5420668,31.2706419
Punjab,Jalandhar,Khera Farm And Cold Store,VPO SALAN NAGAR MALSIYA,Ghanshyam,3,101.975766,4.210484
Punjab,Jalandhar,Khurana Agro Foods Cold Store,Vill Sangha P O Kang Sabhu District Jalandhar,Shri Harish Chander Khurana,2940,75.51456759999999,31.2161042
Punjab,Jalandhar,Khushid Cold Store,V.P.O.TAJPUR,Sarvan Singh,4550,87.6120531,21.6443962
Punjab,Jalandhar,KishanColdstor,UGGINAKODARJALANDHAR,Satnam,4400,75.4330161,31.2151395
Punjab,Jalandhar,Kwatra Cold Store & Ice Factory,PATHAN KOT HIGHWAY ROAD,Satpal Ji,4250,75.6522066,32.2733352
Punjab,Jalandhar,L.RaisonsColdstore,NEARSHABJIMA.NDI,Rajkumar,10000,77.2045867,28.6694461
Punjab,Jalandhar,Lakshmi Islce & Cold Storage,TALWAN ROAD PHILLAUR,Sunil,4400,75.6976106,31.0213296
Punjab,Jalandhar,Laxmi Cold Storage,MOGA ROAD SHAHAKOT,Rajeev Kumar,1250,75.0902219,30.8305453
Punjab,Jalandhar,Lovley Cold Store,VPO MAHALONA BANGA ROAD NAVASHAR,Malkiy Singh,2,76.118642,31.1255583
Punjab,Jalandhar,M/S KHEHRA Cold Storage,VILLAGE- TALWANDI BHARO,ATUL DUBEY,6000,75.4519516,31.1991171
Punjab,Jalandhar,MAGHUR Cold STORE,KHAMBRA ROAD,Sandeep Kumar,3500,75.5693175,31.2817797
Punjab,Jalandhar,Mohan Cold Storage,Village Lambri Distt Jalandhar,Shri Joginder Pal Singh,4712,75.54876019999999,31.2467333
Punjab,Jalandhar,Ms A K Cold Storage Expansion,Godaipur Distt Jalandhar,Shri S Kulwant Singh,2538,75.5764296,31.375031
Punjab,Jalandhar,Ms Dhaliwal Farm Cold Storage,Village Patti Akalpur Tehsil Malsian Jalandhar,Shri Paramjeet Singh,2860,75.3492342,31.1291515
Punjab,Jalandhar,Ms G F Cold Store,Village Uggi Teh Nakodar District Jalandhar,Shri S Gurinder Singh,3117,75.4330161,31.2151395
Punjab,Jalandhar,Ms H S Cold Storage,Vill Rani Bhatti Tehsil Kala Bakra Distt Jalandhar,Shri Kirpal Singh,3808,75.638993,31.4786528
Punjab,Jalandhar,Ms JBF Cold Store,Gonachak Kala Singhian Road District Jalandhar,Shri Mohan Singh,3190,75.5025691,31.2841379
Punjab,Jalandhar,Ms Jammu Cold Storage,Village Bara Pind Kartarpur,Shri Jaspal Singh,2404,75.8170786,31.115787
Punjab,Jalandhar,Ms Kartar Cold Storage,Village Lersiwal Distt Jalandhar,Shri Gurvinder Singh,2256,75.57618289999999,31.3260152
Punjab,Jalandhar,Ms Sandhu Cold Storage,Village Uggi Teh Nakodar District Jalandhar,Shri S Baldev Singh,4567,75.4330161,31.2151395
Punjab,Jalandhar,Ms Shiv Shanker Cold Store,Village Ambgarh Kartarpur Distt Jalandhar,Shri Anil Kumar,4500,75.500939,31.4358241
Punjab,Jalandhar,Ms Shree Bagwati Cold Storage,V P O Singha District Jalandhar,Shri Subhashg Chandra,5650,75.5104729,31.4163242
Punjab,Jalandhar,Ms Shri Guru Har Rai Ji Cold Storage,Village Tahli Sahib P O Kartarpur Ditt Jalandhar,Shri S Jagroop Singh,4816,75.4920178,31.4225638
Punjab,Jalandhar,Ms Shri Guru Hargobind Cold Storage Agriculture Farm,Vill Beas Pind District Jalandhar,Shri S Sukhwinder Singh,1453,75.6323317,31.449506
Punjab,Jalandhar,Ms Surindera Cold Storage Expansion,VPO Sah Jhangi P O Gakhla Jalandhar,Shri Surinder Nath,2980,75.57618289999999,31.3260152
Punjab,Jalandhar,Ms T F Cold Storage,VPO Laharan Pratap Pura Distt Jalandhar,Shri S Manjinder Singh,3080,75.57618289999999,31.3260152
Punjab,Jalandhar,Ms T F Cold Storage Expansion,VPO Loharan Partappura Distt Jalandhar,Shri S Manjinder Singh,1558,75.52811059999999,31.2373751
Punjab,Jalandhar,Ms T N Cold Storage,Vill Rahimpur Distt Jalandhar,Shri S Satnam Singh Nagra,4902,75.4140844,31.2343929
Punjab,Jalandhar,Ms Varindera Cold Chain Systems Pvt Ltd,Village Lallian Kalan Distt Jalandhar,Shri Sarbjit Singh,4638,75.48908750000001,31.2600832
Punjab,Jalandhar,Ms Vrindera Cold Storage,Vill Singhpur Distt Jalandhar,Smt Surinder Kaur,5115,75.46797219999999,31.2079596
Punjab,Jalandhar,Ms.Maharaja Cold Storage,NAKODAR,Nirmal Singh,5,75.4817733,31.1270186
Punjab,Jalandhar,National Cold Store,NURMAHAL ROAD NATIONAL HAIHWAAY NAKODHAR ROAD,Laxman Kumar,2,75.5815936,31.0942647
Punjab,Jalandhar,Neeraj Cold Store,KULAM ROAD NAVOSHAR,Bhajan Lal,1600,76.1321206,31.1312816
Punjab,Jalandhar,New Thind Cold Storage Agriculture Farm,Village Partappura PO Loharan Jalandhar,Shri Daljit Singh,3450,75.52811059999999,31.2373751
Punjab,Jalandhar,Om Cold Storage,PARTAP PURA JALANDHAR,Amit Kumar,3900,75.52811059999999,31.2373751
Punjab,Jalandhar,Om Cold Storage Agri Farm,Village Lohar Partapura Distt Jalandhar,Shri Om Prakash,3860,75.52712319999999,31.2422537
Punjab,Jalandhar,PHUMAN SINGH & SONS Cold STORE,NAKODAR CITY MOGA ROAD JALANDHAR,DARSHAN SINGH,3000,75.4787566,31.1261778
Punjab,Jalandhar,Pannu Cold Storage,VPO Bagga Tehsil Shahkot District Jalandhar,Shri Gurbachan Singh,6448,75.3383027,31.0823586
Punjab,Jalandhar,Panu Cold Storage,VILL BAGA SHAHKOT,Kambar Akwal Singh,6250,75.3383027,31.0823586
Punjab,Jalandhar,Primior Cold Store,MOGA ROAD SHAKOT,Vikramjeet Singh,1200,75.0902219,30.8305453
Punjab,Jalandhar,Punjab Cold Store,ALIPUR ROAD,Kamaldev Thakur,11000,88.3309958,22.5255046
Punjab,Jalandhar,Raj Lce And Oil Mills,LADHOWALI ROAD JALANDHAR,Anand Khanna,2,75.5950012,31.3214282
Punjab,Jalandhar,Sandhar Cold Storage,"RAIPUR ROAD,KAHANPUR GHAV ROAD",Tarsemlal Ji,4000,76.3593872,31.2454425
Punjab,Jalandhar,Sangha Cold Storage,PHOLIYAWALA NEAR MITHAPUR ROAD JALANDHAR,Harbindar Singh,1107,75.5805575,31.2834721
Punjab,Jalandhar,Sant Ice & Cold Storage,CHEEMA ROAD,Aman,1750,74.5673796,32.5413324
Punjab,Jalandhar,Saroya Cold Storage,"VILL.WARIANA,P.O.,NAGRA,DISTT.JALANDHAR",Sardhar Jaswinder Singh,5000,75.5742467,31.218722
Punjab,Jalandhar,Shadi Ram Mohan Cold Store,LAMBRA,Ram Kumar,7000,75.53146339999999,31.2521283
Punjab,Jalandhar,Shan Lal Mohan Cold Store,LAMBRA,Deepak,1894,75.53146339999999,31.2521283
Punjab,Jalandhar,Shathi Cold Storage,SABJI MANDI JALANDHAR,Akhilesh Kumar Mishra,2250,75.57728399999999,31.3596296
Punjab,Jalandhar,Shri Anand Cold Storage Expansion,VPO Mand Kapurthala Road District Jalandhar,Shri Surinder Pal,1350,75.4744711,31.3490499
Punjab,Jalandhar,Shyam Cold Store,JALANDHAR,Gullu,3,75.57618289999999,31.3260152
Punjab,Jalandhar,Shyam Sunder Cold Store,KAPURTHALA BY PASS,T.S UPPAL,3000,75.4017654,31.3722571
Punjab,Jalandhar,Simar Cold Store,KADIANWALI,Jaswinder Singh,3408,75.5807954,31.249577
Punjab,Jalandhar,Sukjeetsingh Batthi Cold Store,ALIPUR JALANDHAR,Sarjeet Singh Bahtti,4300,75.5771573,31.2722633
Punjab,Jalandhar,Sura Cold Storage,VIDHIPUR FATAK JALANDHAR,Sanjay Kumar,2000,75.5298536,31.4032589
Punjab,Jalandhar,Surindera Cold Store,ALIPUR JALANDHAR,Sukjeet Singh,10972,75.5771573,31.2722633
Punjab,Jalandhar,The Kapurthla Jalandhar Corprative Cold Store Ltd,NAKODAR ROAD WADALA CHOKE,Rajendra Singh,4462,75.5436824,31.2922339
Punjab,Jalandhar,Thind Cold Storage,LOHARA PARTAPPURA,Surjit Singh,270,75.52811059999999,31.2373751
Punjab,Jalandhar,Thind Cold Storage,VILL FAZALWAL,Amarjeet Singh,5000,75.33101460000002,31.03807369999999
Punjab,Jalandhar,Turna Cold Storage,VILL FAZALWAL SHAHKOT,Ramesh Singh,6250,75.33101460000002,31.03807369999999
Punjab,Jalandhar,VIRENDRA Cold STORE,VILLAGES- LALIYA KALA POST LAMBRA,HARDEV SINGH,5000,75.53146339999999,31.2521283
Punjab,Kapurthala,Anand Cold Storage,"VILL.DABUR JI ,KAPURTHALA",Moha Lal,4400,75.4017654,31.3722571
Punjab,Kapurthala,B.K.Cold STORE,VILLAGE.KOT KRAR KHAN,Sardar Gurjeet Singh,5000,75.46748649999999,31.3808748
Punjab,Kapurthala,Baba Bir Singh Cold Storage,TODARWAL LINK ROAD,Subash Chand Ji,6000,75.24498919999999,31.3346008
Punjab,Kapurthala,Chadha Cold Storage,KAPURTHALA,Punith,3455,75.4017654,31.3722571
Punjab,Kapurthala,DK/CS,JALANDHAR BYPASS RPAD HOSHIYARPUR,Zv Sanjiv Kumar Sood,2000,75.6002659,31.3487444
Punjab,Kapurthala,Farmer Cold Storage,KAPURTHALA ROAD BOOLPUR,Purushottam Singh,7500,75.2402491,31.3183202
Punjab,Kapurthala,GAURI SHANKAR Cold STORE,VILLAGE AUJALA ROAD KAPURTHALA,VIJAY KUMAR,2000,75.3991457,31.3608545
Punjab,Kapurthala,GOLDY KHALSA Cold STORE,KAPUTHALA TO NAKODAR ROAD,HUSSAN DEEN,4311,75.4017654,31.3722571
Punjab,Kapurthala,Guru Tegbhadur & Ice Factory,JALLOWAL KALA SINGHA,Satnam Singh,3500,75.5030307,31.2844099
Punjab,Kapurthala,Gurunanak Old Store,VILL SEKHUPURA TEH. KAPURTHLA,MANGATRAM SHARMA,12500,75.4017654,31.3722571
Punjab,Kapurthala,GurunanakColdstor,VPOCHOGAMAKAPURTHALA,Bodhraj,3250,75.4257325,31.5735489
Punjab,Kapurthala,Gurutegh Bhadur Cold Store,MADUPUR JALWALA KAPURTHALA,Anil,3,75.4017654,31.3722571
Punjab,Kapurthala,GurutekbhudurColdstorkapurthala,VPOJALLOWALKAPURTHALA,Jitender,4000,75.4274422,31.2423988
Punjab,Kapurthala,Jagir Cold Storage,VILLAGE WADALA PIND KAPURTHALA,Naveen Kumar,5124,75.4017654,31.3722571
Punjab,Kapurthala,K.F Cold STORE,VILLAGE MADHOJHANDA,DIGVIJAY SINGH,5000,75.3720056,31.3278964
Punjab,Kapurthala,MS B K Cold Store,Village Kot Karar Khan Tehsil Distt Kapurthala,Shri Suresh Kumar,4386,75.46748649999999,31.3808748
Punjab,Kapurthala,Makija Cold Store,HOSHYARPUR ROAD PHAGWARA KAPURTHLA,Ravindhar,3,75.7726223,31.2341558
Punjab,Kapurthala,Ms D F Cold Storage,Vill Ladhewal Saidowal Road District Kapurthala,Shri Iccha Singh,5548,75.3692732,31.320063
Punjab,Kapurthala,Ms Dashmesh Cold Storage,Vill Bahui PO Sheikhupur District Kapurthala,Shri Gurmukh Singh,5584,75.3836931,31.387092
Punjab,Kapurthala,Ms Dhawan Cold Storage,Village Sawal Town Sultanpur Lodhi District Kapurthala State Punjab,Shri Tarsem Lal Dhawan,2740,75.1928403,31.2638312
Punjab,Kapurthala,Ms Keshav Cold Storage,Vill Khusrupur Distt Kapurthala,Shri Rahul Kawatra,6090,75.3849248,31.2557543
Punjab,Kapurthala,Ms P S Butter Cold Storage,Vill Kot Karar Khan Distt Kapurthala,Shri S Balbir Singh,4762,75.46748649999999,31.3808748
Punjab,Kapurthala,NajjarColdstor,VPO KALA SINGHA KAPURTHALA,Gurucharansingh,5000,75.5030307,31.2844099
Punjab,Kapurthala,P.S.BUTTAR Cold STORE,VILLAGE KOT KARAR KHA KAPURTHALA,Ramji,5000,75.46748649999999,31.3808748
Punjab,Kapurthala,RANJIT Cold STORE,VILLAGE JAWALAPUR KASSOCHAH,Ramesh Kumar Verma,1720,78.10710569999999,29.9267729
Punjab,Kapurthala,SOHAN Cold STORE,VILLAGE AUJALA ROAD KAPURTHALA,NARENDER JI,2900,75.3991457,31.3608545
Punjab,Kapurthala,Tara Cold Store,VPO MAMSOORWALDONA AUJALA ROAD KAPURTHALA,Ravrndhar Singh,4000,75.3991457,31.3608545
Punjab,Ludhiana,BJ Cold Store,VPO Sarabha District Ludhiana,Shri Bhavjit Singh,5000,75.70371070000002,30.7491396
Punjab,Ludhiana,Bansal,KHANNA,Radhey,3,76.2169907,30.70707689999999
Punjab,Ludhiana,Cheema Cold Storage,"G T ROAD, BEHIND POWER HOUSE, KARTARPUR, KARTARPUR",Narendra Ji,4,75.0151127,32.0879424
Punjab,Ludhiana,Dakar Cold Store,CHD ROAD,Som Nath,6,75.8729565,22.7626001
Punjab,Ludhiana,Dashmesh Cold Store,SALIM TABRI,Pawan Sharma,7660,75.83175469999999,30.9363373
Punjab,Ludhiana,Fateh Cold Store,AYALI KHURD,B.S. Grewal,2,75.7749395,30.9131363
Punjab,Ludhiana,GURU NANAK Cold STORE,LUDHIANA TO JALANDHAR BY PASS,A.S CHAUHAN,4500,75.57618289999999,31.3260152
Punjab,Ludhiana,Govind Cold Storage,VILL GADHI TARKHANA MACHIWARA LUDHIANA,Pavan Kumar,3500,76.19286400000001,30.9141349
Punjab,Ludhiana,K.C. Cold Store,NEW GREEN MARKET,Ramesh Sharma,1250,76.9693468,29.5459124
Punjab,Ludhiana,Kakkar Cold Storage,SAMRALA,Mahander,4724,76.1910284,30.8356679
Punjab,Ludhiana,Kisan Cold Storage,"KARABARA ,G.T. ROAD LUDHIANA",Gaya Prasad,1215,75.8888152,30.8754888
Punjab,Ludhiana,Maha Laxmi Vishnu Cold Store Pvt.Ltd.,"16,OLD.GRAIN MARKET JAGROAN",Amritpal Singh,6.048,75.468541,30.7970477
Punjab,Ludhiana,Ms Handa Cold Storage,Ramgarh Bhullar Sidhwan Bet Road District Ludhiana,Shri Ajay Handa,3218,75.483991,30.8578239
Punjab,Ludhiana,Ms Jai Shree Gurdev Cold Storage,Vill Shamaspur Distt Ludhiana,Shri Varinder Kumar,5000,76.1740266,30.8065561
Punjab,Ludhiana,Ms Jas Cold Storage,Vill Sidhwan Bet Jagroan Road Distt Ludhiana,Prabhjeet Singh,4500,75.4723411,30.9294951
Punjab,Ludhiana,Ms Jas Cold Storage Expansion,Sidhwan Bed To Jagraon Raod Ludhiana,Shri S Prabhjeet Singh,1432,75.5164274,30.7160234
Punjab,Ludhiana,Ms Jaswant Cold Storage,Village Rohla Distt Ludhiana,Shri S Baljinder Singh,2200,76.14250439999999,30.84852859999999
Punjab,Ludhiana,Ms Mangat Cold Store,Chandigarh Road Samrala Distt Ludhiana,Shri Gurpreet Singh,3380,76.1944362,30.8440723
Punjab,Ludhiana,Ms Nand Cold Storage,Vill Sahouli Dist Ludhiana,Shri S Avtar Singh,2841,75.6862616,30.7753091
Punjab,Ludhiana,Ms Punjab Cold Storage,Village Pandori Tehsil Jagraon District Ludhiana,Shri Gurpreet Singh,1650,75.6397204,30.8291154
Punjab,Ludhiana,Ms Punjab Cold Store Expansion,Vill Pandori Jagraon Road Mullanpur Ludhiana,Shri Rajinder Singh,1400,75.5164274,30.7160234
Punjab,Ludhiana,Ms Sarabha Cold Storage,Vill Toosa Distt Ludhiana,Shri Hargurpreet Singh,2958,75.67171909999999,30.73430209999999
Punjab,Ludhiana,Plahey Cold Stroage,SIDHWAN BET ROAD,Nachhattar Singh,3500,75.4723411,30.9294951
Punjab,Ludhiana,Punjab Cold Store,KHANNA ROAD,Balveer Singh,4000,73.0996727,33.6280891
Punjab,Ludhiana,Raj Cold Store,KOHARA ROAD SANEWAL LUDHIANA,Harry,1400,75.9847233,30.8498478
Punjab,Ludhiana,Raja Shree Cold Storage,KARA BARA CHOWK,Harvinder,4800,75.8453822,30.9366288
Punjab,Ludhiana,Randawa Cold Store,KACHA MALAK ROAD JAGRAON,Jagjeet Singh,22545,75.4822342,30.8031994
Punjab,Ludhiana,S.S. Cold Storage,KARABARA G.T.ROAD LUDHIANA,Karen Yadav,5907,75.8442736,30.936786
Punjab,Ludhiana,Sanhu Cold Storage,MACHIWARA GADHI TARKHANA LUDHIANA,Ajay Shing,2800,76.1772871,30.8881809
Punjab,Moga,BRAR FOODS PVT .LTD.,BAGHA PURANA MOGA,JEEVAN SINGH INCHARGE,3500,75.0940031,30.6856791
Punjab,Moga,Chawala Cold Store,G.T.ROAD MOGA,Inderpreet Singh,2976,75.1876674,30.8215427
Punjab,Moga,Grand Father Food Processing Cold Storage,Village Mehna District Moga,Smt Rajinder Kaur,3604,75.27003859999999,30.8023827
Punjab,Moga,Hemkunt Cold Storage,KOTPURA ROAD,Jitendra Kumar,8000,74.529985,30.4777485
Punjab,Moga,Ms Dashmesh Cold Storage,Village Indergarh Teh District Moga,Shri S Gurtej Singh,3160,75.3076904,30.9288126
Punjab,Moga,Ms Kissan Cold Storage Agriculture Farm,Vill Patti Rajpur Distt Moga,Shri Stish Kumar,3117,75.17344709999999,30.8230114
Punjab,Moga,Ms Krishna Cold Storage,Vill Kokri Kalan P O Janubi Distt,Shri S Amarjeet Singh,1664,75.33247229999999,30.8460744
Punjab,Moga,Ms Miri Piri Cold Storage,Village Dodhar Garbhi Distt Moga,Shri Pritam Singh,2250,75.2479061,30.6874426
Punjab,Moga,Ms Ram Ditta Cold Store,Village Darapur Tehsil Distt Moga,Shri Madan Lal,2500,74.96033129999999,30.8433147
Punjab,Moga,Preet Cold Store,GHAL KALAN,Mahesh Agarwal,3500,75.1049137,30.8196492
Punjab,Moga,Ranouta Cold Store,NIHAL SINGH ROAD,Parminderpal Singh,4000,77.2684647,28.3452982
Punjab,Moga,Toor Cold Store,GREEN FIELD COLLNEY,Balbeer Singh,2400,77.2891038,28.4625737
Punjab,Patiala,A.P Cold Store,RAJPURA TO JHIRAKH PUR ROAD,Sham Lal Singh,3000,76.5905317,30.4765796
Punjab,Patiala,Bedi. Cold. Storage,BEDI. COLD. storageE VILL DHAMOLI PATIALA. BYPASS,Jaswindar. Singh,850,76.3868797,30.3397809
Punjab,Patiala,Jain Ice & Cold Storage,BAHERA ROAD PATIALA,Munish Kumar,390,76.3947899,30.325949
Punjab,Patiala,Jain. Cold. Storage,NEAR. LIBARTY. CHOCK. PATIALA. ROAD. RAJPURA,Manoj. Kumar,500,76.5905317,30.4765796
Punjab,Patiala,Manav Cold Storage,NABHA MALERKOTLA ROAD VPO DHINGI PATIYALA,Yashvindhar Puri,2,76.0989352,30.4035598
Punjab,Patiala,Mann Cold Storage,VILL.RAMNAGAR,Partap Chand,4550,77.27989629999999,12.7208614
Punjab,Patiala,MulitipurposeColdstorpvt.Ltd,SANOURROADPATIALA,Amandeepgarg,4800,76.4307035,30.3128699
Punjab,Patiala,RanaColdstor,IGARH ROAD,Sureshrana,1300,78.0880129,27.8973944
Punjab,Patiala,Shankar Cold Storage,AMBALA ROAD GANDIA RAJPURA,Sohanlal,2500,76.5905317,30.4765796
Punjab,Patiala,SinglaColdstorpvt.Ltd,DEVIGARHROADPATIALA,Bushansingla,3500,76.4169753,30.3166364
Punjab,Patiala,Triloki Cold Storage,OLD SUBJI MANDI PATIALA,Punkaj Goel,2400,76.4004337,30.3212189
Punjab,Rupnagar,Bharat Cold Storage,VILL. KHUWASHPUR. NANGAL ROAD ROPAR,Shanjay Kumar,2240,76.5428998,30.9812949
Punjab,Rupnagar,Hera Cold Storage,CHANDIGARH. ROAD RUPNAGAR,Ranveer Singh,2880,76.2589346,30.8253301
Punjab,SAS Nagar,Ms Dashmesh Cold Storage,Vill Gharaun Distt S A S Nagar Mohali,Shri Saurav Aggrawal,1047,76.557493,30.7727958
Punjab,Sangrur,Global Healthy Cold Store,NEW SABJI MANDI ROAD,W.S,2,76.3198284,29.3274466
Punjab,Sangrur,Gurunanak Cold Storage,SHERPUR ROAD DHURI,Balwan Shing,22000,75.84684949999999,30.3783951
Punjab,Sangrur,Hemsons Cold Storage,KAKARWAL DHURI,Surinder Singh,3200,75.8345118,30.3692008
Punjab,Sangrur,Jain Cold Storage,NEAR MATA RANI DHURI,Satish Sing,150,75.86065479999999,30.3692859
Punjab,Sangrur,Suraj Kund Cold Storage P.Ltd,"KADIYAL ROAD ,SUNAM",Krishna Goyal,20,75.8013975,30.1305581
Punjab,Tarn Taran,Josan Agro Foods Cold Storage,VPO Ekal Gadda Tehsil Sahib District Taran Taran,Shri S Manjeet Singh,4023,75.06745339999999,31.5108902
Punjab,Tarn Taran,Ms K K Agro Foods Cold Storage,Vill Balla Chak Amritsar Road Distt Tarantaran,Shri Keval Krishan Sharma,3719,74.8899123,31.5523351
Punjab,Tarn Taran,Sona Chandi Warehousing Solutions,Village Bala Chak Town Tarantaran District Tarantaran,Smt Kiran Arora,5942,74.89091499999999,31.55148449999999
Rajasthan,Ajmer,Alwer Zila Dugdh Utpadak Sahkari Sangh Ltd.,ALWAR DAIRY JAIPUR ROAD,H.S.Thainwa,150,76.6345735,27.5529907
Rajasthan,Ajmer,Jayanti Cold Storage,JAYANTIDRINKS[At]EMAIL[Dot]COM,Yashvant Mathur,200,76.6046039,27.5666898
Rajasthan,Ajmer,K.M. Cold Storage And Ice Factory Pvt Ltd,RIICO PH-III INDUSTRIAL AREA BEAWAR,Sunny Mittal,2800,74.31990379999999,26.104585
Rajasthan,Ajmer,Shree Ji Cold Storage,VILLAGE PIPLAJ ROAD BEAWAR,Narian Prasad,1000,74.3795114,26.1620796
Rajasthan,Bharatpur,Agree Ganesh Colud,SEVAR ROD MADHURA WAYPAS,Rajveer Singh,1,75.8474894,22.7661838
Rajasthan,Bharatpur,Bharatpur Cold Storage Pvt Ltd,GHANA SEVER ROAD,Amar Singh,3060,-1.023194,7.946527
Rajasthan,Bharatpur,Bhekaum Sheth Grahe P.Ltd.,"DHARA ROAD, (GRAM)KABAI NADBAI (THASIL)",Methu Singh,2100,77.20382029999999,27.2127282
Rajasthan,Bharatpur,Dhakad Cold Storage,PANCHAYAT SAMITI BAYANA,Mahesh,1,77.28767739999999,26.9147286
Rajasthan,Bharatpur,Dr Oil Industry (Cold Storag),MATHURA ROAD,Kamal Singh,4700,77.2401157,28.6112543
Rajasthan,Bharatpur,LRG Cold Storage,RAFHE KUMHER MATHURA ROAD,Lajpat,750,77.3777204,27.3144641
Rajasthan,Bharatpur,Nadbai Cold Storage Pvt Ltd,BAILARA NADBAI,Nadbai Cold Storage Pvt Ltd,4000,77.22542659999999,27.2027339
Rajasthan,Bharatpur,Shree Omendra Cold Storage,GHASOLA AGRA ROAD,Jitendra Bansal,5000,76.2609463,28.5530001
Rajasthan,Bharatpur,Vaibhav Cold Storage,VILLAGE KHERA NADBAI,Rajesh Kumar,5000,77.20382029999999,27.2127282
Rajasthan,Bhilwara,Shiv Sudarshan Poly Fab Private Limited,E 178 A Growth Centre RIICO Swaroopganj Bhilwara,Shri Rahul Agarwal,1500,74.63125959999999,25.2247623
