STATE,DISTRICT,Storage name,Address,Manager Name,capacity,Longitude,Latitude
Andaman And Nicobar Islands,South Andamans,Islander Marine Pvt Ltd,PORT BLAIR,Senthil O R,99,92.7264828,11.6233774
Andaman And Nicobar Islands,South Andamans,Joy Josephs,GOVIND NAGAR,Joy Josephs,15,80.3093914,26.4492218
Andaman And Nicobar Islands,South Andamans,New India Marine Pvt Ltd,NEW WANDOOR,Vincent Alvbiua,99,76.2360376,11.1955096
Andaman And Nicobar Islands,South Andamans,Ranjit Paul,B/85 INDUSTRIAL STATE DOLLYGUNJ,Ranjit Paul,60,92.7120575,11.6357989
Andaman And Nicobar Islands,South Andamans,Ten Tonne Cold Storage Ice Plant,LITTLE ANDAMAN,D. Mukherjee,99,2.1521917,41.3923703
Andaman And Nicobar Islands,South Andamans,Ten Tonne Cold Storage Ice Plant,CYLONE BASTHI LITTLE ANDAMAN,D Mukherjee,999,2.1521917,41.3923703
Andhra Pradesh,Chittoor,Bismilla Fruits,"KALLUR, BACK SIDE POLICE STATION, KALLUR",Nabisahab,6,79.0004517,13.5583316
Andhra Pradesh,Chittoor,G.Venkatramana Reddy Fruits,PUNGANOOR OLD BUS STAND,B.Sudhakar,5,78.5712022,13.3664136
Andhra Pradesh,Chittoor,Jain Unit 1,GOLLPALLI,Gollapalli,17000,80.90931479999999,16.7269099
Andhra Pradesh,Chittoor,KSA AGRI Cold Storage PVT LTD.,PUNGANOOR,Iftekhr Ali Ahmed,9000,78.5713232,13.368608
Andhra Pradesh,Chittoor,Madina Fruits,"PILLERU ROAD, MAIN ROAD, KALLUR",Ps.Sayed Basha,10,79.0004517,13.5583316
Andhra Pradesh,Chittoor,Mkb Cold Storage Pvt Ltd,"PUNGANUR, ROYALPETA ROAD",M.Jagdish,4000,80.2640711,13.0539587
Andhra Pradesh,Chittoor,Murgan Cold Storage Pvt Ltd,RAMASAMUDRAM ROAD PUNGANUR,K.Vasu,4500,78.5713232,13.368608
Andhra Pradesh,Chittoor,Sab Cold Storage,GUDURPALLI VILLEGE PUNGANUR,S.Afzal,8000,78.5713232,13.368608
Andhra Pradesh,Chittoor,Said Sairam Cold Storage Pvt Ltd,"2/250/B, AMMACHERU MITTA, KADIRI ROAD, MADANAPALLY",Co.Nagarajgupta,2500,78.50100069999999,13.5560496
Andhra Pradesh,Chittoor,Sri Lakshmivinayaka Fruits Mundi A/C Chamber,"FLAT NO 17, MANGO MARKET, TIRUCHANOOR ROAD, TIRUPA",B.Purushothamreddy,30,79.4191795,13.6287557
Andhra Pradesh,Chittoor,Sri.Lakshmivenkateshwarabanana Traders,"SHOP NO 5, AMC MARKET YARD, MARKET YARD, TIRUPATHI",S.Jayakrishana,8615,79.4191795,13.6287557
Andhra Pradesh,Chittoor,Srinifoodpark,MOGILI,Bhanu,300,78.8364948,13.1847107
Andhra Pradesh,Guntur,Amaralingeswara Cold Storage Pvt Ltd,MACHARLAROAD NADIKUDI VILAGE DACHEPALLY MANDAL,Vankayala1 Satyanarayana,6000,79.7068596,16.5879495
Andhra Pradesh,Guntur,Amaravathi Cold Storage,"578/3, LAAPURAM, NEAR MIRCH YARD ANKI REDDY PALEM",Srinivadarao,6636,80.41071389999999,16.2864231
Andhra Pradesh,Guntur,Amulya Cold Storage m,DNO9-82 NH-5 LALPURAM BY PASS ROAD,Venkateswrao,4099,80.22192609999999,13.1425492
Andhra Pradesh,Guntur,Boppudi Cold Storage Pvt Ltd,NH 5 BOPPUDI VILAGE CHILAKALURIPET MANDAL,Kumar,3200,80.1656205,16.0948008
Andhra Pradesh,Guntur,Brahmari Cold Storage,ANKIREDDYPALLI,Nagaraju,7943,79.0072883,15.3960875
Andhra Pradesh,Guntur,Chilakaluripet Cold Storage Pvt Ltd,NH5 TATA PUDI VILAGE CHPETA MANDAL,Ramarao,8000,80.1655471,16.0944603
Andhra Pradesh,Guntur,Dasu,ANKIREDDY PALEM NH-5BY PASS ROAD,Syam,8086,-71.5723953,43.1938516
Andhra Pradesh,Guntur,Dhanyalaxmi Cold Storage Pvt Ltd,GURAJALA VILAGE MANDAL,V.Suresh,5000,79.6371314,16.5580212
Andhra Pradesh,Guntur,Driveway Cold Storage,LALPURAM NH-5 PROGRAM BY PAS,A Subbarao,4510,80.4494344,16.2868497
Andhra Pradesh,Guntur,G.S.R. Cold Storage Pvt Ltd,CHPETA ROAD LAALAPURAM PANVHAITI,Sriharirao,10000,82.0031455,16.5774798
Andhra Pradesh,Guntur,Guntur Cold Storage,"SUBBAREDDY NAGAR,ANKIREDDY PALEM",Ramesh,2833,80.39230789999999,16.2876751
Andhra Pradesh,Guntur,Himagiri Cold Storage,NALLAPADU ROAD,Srimanrayanaa,3500,80.3939109,16.3063385
Andhra Pradesh,Guntur,Jaibalaji Cold Storage Pvt Ltd,GUNTUR ROAD KOTANEMALIPURI VILAGE RAJUPALEM MANDAL,K.Rameshbabu,4000,79.9296871,16.4532676
Andhra Pradesh,Guntur,Jayalakshmi Cold Storages,"AGRICULTURAL MARKET YARD PREMISES, NALLAPADU ROAD",P Srinivas,2744,80.3939109,16.3063385
Andhra Pradesh,Guntur,JyothiswaroopaColddivison Pvt Ltd,NH5DNO9-134 ANKI REDDY PALEM,Venkatreddy,6300,80.2091128,15.9060837
Andhra Pradesh,Guntur,Kanipakavigneswara Cold Storage,NH-5 BOPUDI CHILAKALURIPET,Haribabu,6000,80.1655471,16.0944603
Andhra Pradesh,Guntur,Karempudi Cold Storage Pvt Ltd,"JULLAKOL ROAD, PETASANNI GANDLAKARAMPUDI",Mallikarjunrao,4800,79.7568107,16.4191158
Andhra Pradesh,Guntur,Kaveri,GT ROAD,Arun,2000,74.2390965,31.8847743
Andhra Pradesh,Guntur,Kaveri Multi Purpose,NH 5 MARCHI YARD,Arun,3000,77.1031998,31.0306204
Andhra Pradesh,Guntur,Kommineni Cold Storage,NH5 DN O5-72 ANKIREDDY PALEM,Swamydhar,4000,83.9275643,18.3159269
Andhra Pradesh,Guntur,Kondaveedu Cold Storage,MIRCH YARDNALLAPADU ROAD,Rambabu,4000,80.3939109,16.3063385
Andhra Pradesh,Guntur,KurriAnnapurnammaGovindaReddy Cold Storage,ANKIREDDY PALEM NH-5,K Sambireddy,7000,83.9275643,18.3159269
Andhra Pradesh,Guntur,Kurriannapurnammagovindareddy Cold Storage Pvt Ltd,NH5 DN O5-45 ANKIREDDY PALEM,Sambireddy,5625,83.9275643,18.3159269
Andhra Pradesh,Guntur,Lakshminarasimha Cold Storage,ANKIREDDY PALEM VILLAGE,Satyanarayana,5438,80.39230789999999,16.2876751
Andhra Pradesh,Guntur,Lakshmiprasanna Cold Storage,"LALPURAM, NH-5",Anasuya,5000,77.1031998,31.0306204
Andhra Pradesh,Guntur,Laxmi Vidhya Cold Storage,LALAPURAM,Bhanu,4000,80.32827379999999,17.2181353
Andhra Pradesh,Guntur,Laxminarasimha Cold Storage,"D NO 658/A 659B, 660/A ANKIREDDY PALEM VILLAGE",Venkatapathiraju,5400,80.39230789999999,16.2876751
Andhra Pradesh,Guntur,Laxmivallabha Cold Storage,NH5 LALAPURAM BY PASS ROAD,B Hanumantharao,9763,82.0031455,16.5774798
Andhra Pradesh,Guntur,MS K S R Cold Storage Pvt Ltd,D No 466 3 Nadikudi V Dachepalli M Guntur District,Shri K Sreenivasa,11000,79.7068596,16.5879495
Andhra Pradesh,Guntur,MS Vasaviratna Cold Storage Pvt Ltd,Thikkireddypalem V Parthipadu M Guntur District,Shri Kothuri Venkata Appa Rao,7000,80.3358008,16.1813812
Andhra Pradesh,Guntur,Mahalaxmi Cold Storage Pvt Ltd,DURGI ROAD MACHARLA VILAGE MANDAL,S.K.Ameer,4675,79.4365006,16.4760816
Andhra Pradesh,Guntur,Mittapalemnarayanaswamy Cold Storage,ANKIREDDY PALEM NH-5,Prasadrao,4000,83.9275643,18.3159269
Andhra Pradesh,Guntur,Ms Palanadu Cold Storage,Rentachintala Village Guntur Dist,Ch Madhu Babu,7000,79.5524538,16.5544667
Andhra Pradesh,Guntur,Ms Uday Agro Technology Pvt Ltd,Sy No 66 B Etukur Village Old Guntur Guntur Distt,Shri J K Praveena Kumari,5000,80.44675889999999,16.2896415
Andhra Pradesh,Guntur,Nandini,ANKIREDDIPALEM VILLAGE,Satishverma,5000,80.39230789999999,16.2876751
Andhra Pradesh,Guntur,Nandini Cold Storage,ANKIREDDYPALEM VILLAGE,B Subhash,4700,80.39230789999999,16.2876751
Andhra Pradesh,Guntur,Palanadu Cold Storage,RENTACHINTALA VILAGE NEAR MARKET YARD MACHARLA ROA,A.Somasekhar,5400,79.5524538,16.5544667
Andhra Pradesh,Guntur,Panchamukha Cold Storage,"NH-5, ANKIREDDY PALEM",Srinivasarao,4000,80.39230789999999,16.2876751
Andhra Pradesh,Guntur,Pranathi Cold Storage,NH 5 MARCHI YARD,Naraaimharao,5000,77.1031998,31.0306204
Andhra Pradesh,Guntur,PsrsonsCold Storage,8-282 TENALI VDALAMUDI,Umasankarrao,3600,80.5605111,16.2355855
Andhra Pradesh,Guntur,Pushpa Athi,KANUPARRU,Krishnamurthy,8000,80.110827,16.209323
Andhra Pradesh,Guntur,Raghavendra Cold Storage,ANKIREDDY PALEM NH-5 NALLAPADU ROAD,Venkayeswarareddy,4500,80.39188949999999,16.3002007
Andhra Pradesh,Guntur,Raghavendra Cold Storage,LALAPURAM,Srinivasarao,1681,80.32827379999999,17.2181353
Andhra Pradesh,Guntur,RamyaCold Storage,"IST LANE LAKSHMIPURAM, VIJAYA TOWERS",Amarswamy,2565,80.2491427,13.0538525
Andhra Pradesh,Guntur,Ratan Cold Storage,"G.N.T. ROAD,RAJAHMUNDRY",Raja,1500,81.8040345,17.0005383
Andhra Pradesh,Guntur,S.V. Cold Storage,NH5 ANKI REDDY PALEM,Surendrababu,5000,80.2091128,15.9060837
Andhra Pradesh,Guntur,Sai Cold Storage,"LALPURAM, NH-5 BY PASS ROAD",Malleswarao,5850,77.1031998,31.0306204
Andhra Pradesh,Guntur,SaisankarCold Storage,LALAPURM,Srinivasaarao,5000,80.32827379999999,17.2181353
Andhra Pradesh,Guntur,Saisivam Cold Storage,"270/1 LALPURAM BY-PASS ROAD, NH-5",Sivaramakrishna,4500,77.1031998,31.0306204
Andhra Pradesh,Guntur,Saisivam Cold Storage,NALLAPADU ROAD,Tagjavrao,3000,80.3939109,16.3063385
Andhra Pradesh,Guntur,Sambhavi,CHILAKALURIPET ROAD NEAR MARCHIYARD,Sathish,3000,80.0702897,16.2227265
Andhra Pradesh,Guntur,Sambhavi Cold Storage,ANKIREDDY PALEM NH-5,Anilkumar,3000,83.9275643,18.3159269
Andhra Pradesh,Guntur,Sambhavi Cold Storage,ANKI REDDY PALEM BY-PASS ROAD CHEK POST,Rajesh,5400,80.2091128,15.9060837
Andhra Pradesh,Guntur,Sangamdairy,VADLAMUDI VILAGE CHEBROLU MANDAL,V.Chandrasekhar,1,80.5605111,16.2355855
Andhra Pradesh,Guntur,Sarachandra Cold Storage pvttd,DNO9-63 ANKI REDDY PALEM BY PASS ROAD,Mvvrprasad,4000,80.2091128,15.9060837
Andhra Pradesh,Guntur,Sarada,NARASARAOPETA,Raghavarao,2000,80.04964989999999,16.2359181
Andhra Pradesh,Guntur,Shambavi Cold Storage,NH5 DNO 6-75 ANKI REDDY PALEM,Subbareddy,3000,80.39230789999999,16.2876751
Andhra Pradesh,Guntur,Shivaparwathi Cold Storage Pvt Ltd,GANGAVARAM VILAGE NEAR AMBAPUR AMGURAJAL MANDAL,A.Prasad,4000,72.608464,23.1509255
Andhra Pradesh,Guntur,Sindhuri Cold Storage Pvt Ltd,ANKIREDDY PALEM NH-5,Sivaramprasad,6000,83.9275643,18.3159269
Andhra Pradesh,Guntur,Sivasai Cold Storage,4-191 NALLAPADU ROAD ANKIREDDY PALEM,Tnarasi Harao,5000,80.3919698,16.3002171
Andhra Pradesh,Guntur,Sravanthi Cold Storage,BY-PASS JUNCTION ANKI REDDY PALEM NH-5,Ramarao,9350,80.2091128,15.9060837
Andhra Pradesh,Guntur,Sravanti Cold Storage,"NH 5, ANKIREDDY PALEM",Chaitanya,9350,80.39230789999999,16.2876751
Andhra Pradesh,Guntur,Sreeneelanpatilakshmiammavari,"394/1, NEW AMC YARD, DUGGIRALA",Narayana,11700,80.6271912,16.3273225
Andhra Pradesh,Guntur,Sri Ganapathi Drug Intermediates Pvt Ltd,Industrial Park Nadikudi V Dachepalli M Guntur Dt,Shri Thatikonda Koti Reddy,5400,79.7068596,16.5879495
Andhra Pradesh,Guntur,Sri Ganapathi Drug Intermediates Pvt Ltd,Industrial Park Nadikudi V Dachepalli M Guntur Dt,Shri Thatikonda Koti Reddy,5400,79.7068596,16.5879495
Andhra Pradesh,Guntur,Sri Ramachandra Deep Cold Storages,"303,SAI TOWERS, 1ST LINE,, SANTHI NAGAR",Ramesh Babu,4500,77.5992505,12.9577549
Andhra Pradesh,Guntur,Sribuvaneswari Cold Storage,NH 5 TATAPUDI VILAGE CHPETA MANDAL,Venkatewarao,14000,80.1655471,16.0944603
Andhra Pradesh,Guntur,Srichaitanya Cold Storage,NH5 DN O9-91 ANKI REDDY PALEM,Sambasivarao,3300,80.39230789999999,16.2876751
Andhra Pradesh,Guntur,Srichandrasekhara Cold Storage Pvt Ltd,LINGAYA PALEML ALUPURAM PANCHAITI,Ramana,4000,80.3940473,16.2772029
Andhra Pradesh,Guntur,Sridevi Cold Storage,LALPURAM,Ramataao,5116,80.4494344,16.2868497
Andhra Pradesh,Guntur,Sriganapathi Cold Storage,PLOT NO 2B INDUSTRIAL PARKMIRYALAGUDA ROAD NADIKUD,V.Krishnareddy,4950,72.86336349999999,22.6915853
Andhra Pradesh,Guntur,Sriharihara Cold Storage,AMARAVATHI ROAD PEDAKURAPADU VILAGE MANDAL,B.Ravichandran,6440,80.2593253,16.4697857
Andhra Pradesh,Guntur,SrimanjunadaCold Storage,BY PASS ROAD LALPURAM NH-5,Sarathbabu,10487,83.9275643,18.3159269
Andhra Pradesh,Guntur,Sripuspavathi Cold Storage Pvt Ltd,KANAPARRU VILAGE CHPETA ROAD NADENDLA MANDAL,Krishnamurthy,3400,80.110827,16.209323
Andhra Pradesh,Guntur,Sriramnjaneya Cold Storage,"NH 5, ANKIREDDY PALEM",Ramanjaneelu,8650,80.39230789999999,16.2876751
Andhra Pradesh,Guntur,Srisaitirumala Cold Storage Pvt Ltd,PIDUGURALLA ROAD DACHEPALLY VILAGE DACHEPALLY MAND,N.Venkateswarlu,7500,79.9336279,16.2955978
Andhra Pradesh,Guntur,Srisaividhya Cold Storage,CHUTTUGUNTA,Bhanychans,3600,80.645438,16.5175347
Andhra Pradesh,Guntur,SrisaradaCold Storage unit,"BODIAM X ROAD,TENALI ROAD",Sudheer,7500,80.5718682,16.4306645
Andhra Pradesh,Guntur,SriseetaramaCold Storage,"B-125, BEHIND MIRCHI YARD NALLAPADU",Venugopalrao,3292,80.41071389999999,16.2864231
Andhra Pradesh,Guntur,Srishirisrinivasa Cold Storage Pvt Ltd,GUNTUR ROAD REPUDI VILAGE PHIRAMGI PURAM MANDAL,Veerareddy,4400,80.25321360000001,16.2882459
Andhra Pradesh,Guntur,Srisneha Cold Storage,"SRI KRUPA MARKET,MAHBOOB MANSION, MALAKPET",P Anjaneelu,2000,78.49097669999999,17.3716458
Andhra Pradesh,Guntur,Srithirumala Cold Storage,NALLAPADU ROAD NEAR NH-5,Parayya,4000,80.3939109,16.3063385
Andhra Pradesh,Guntur,Srivenkateswara Cold Storage,PRATTIPADU VILAGE MANDAL,Ch.Seshaiah,5000,82.1917781,17.2294723
Andhra Pradesh,Guntur,Srivenkateswara Cold Storage,NARASARAOPETA,Venkatrssaerao,5000,80.04964989999999,16.2359181
Andhra Pradesh,Guntur,Srivenkatrswaracooperative,DNO-C-158 VILL-KOMMURU MANDAL KAKUMANU,Venkatrsearao,4000,80.3982025,16.054913
Andhra Pradesh,Guntur,Srosaitulasicodstorage,ANKIREDDY PALEM NH-5 BY PAAS ROAD,Chandrasekhar,8700,83.9275643,18.3159269
Andhra Pradesh,Guntur,Subhammaheswari Cold Storage,"NARSARAOPETA, CHENNAI ROAD",Maheswarao,6500,80.2704622,13.0843007
Andhra Pradesh,Guntur,Sv Cold Storage,ANKI REDDY PALEM ROAD NH-5,Surendrababu,5000,83.9275643,18.3159269
Andhra Pradesh,Guntur,TheandhrabankFarmers Servicecooperativesociety,NALLAPADU ROAD NEAR NH-5,Subbaiah,2400,80.3939109,16.3063385
Andhra Pradesh,Guntur,Tiyaguru Cold Storage,NALLAPADU ROAD NEAR NH-5,Tiyaguru,3500,80.3939109,16.3063385
Andhra Pradesh,Guntur,Vanadurga Cold Storage,NEAR BYPAS ROAD MIRCHI YARD ROAD ANKI REDDY PALEM,G Spring Astral,2000,80.39230789999999,16.2876751
Andhra Pradesh,Guntur,Vardhani Cold Storage,NALLAPADU ROAD,Subtahmanyam,3500,80.3939109,16.3063385
Andhra Pradesh,Guntur,Vasaviratna Cold Storage Pvt Ltd,"THIKKA REDDY PALAM, PRATHIPADU MANDAL",A.Gopalrao,7000,82.1917781,17.2294723
Andhra Pradesh,Guntur,Vasthsalya Cold Storage M,"NH-5 BY PASS ROAD, ANKI REDDY PALEM",Lappireddy,6000,80.2091128,15.9060837
Andhra Pradesh,Guntur,VasundaraColdstorage,NH5ANKIREDDYPALEMGUMTUR,Hanmanthrao,4000,83.9275643,18.3159269
Andhra Pradesh,Guntur,Vengamamba Cold Storage,NALLAPADU ROAD,G Satyanaraya,3000,80.3939109,16.3063385
Andhra Pradesh,Guntur,Vigneswara Cold Storage,NANDIGAMA VILAGE SATTENAPALLY MANDAL AMARAVATHI RO,Y.Mutyanjayarao,5000,77.7523039,20.9319821
Andhra Pradesh,Guntur,Vijayasaradhi Cold Storage,ANKI REDDY PALEM BY-PASS ROAD CHEK POST,P Nageswara Rao,2000,80.2091128,15.9060837
Andhra Pradesh,Guntur,VijayasriCold Cold Storage,"270/1,LALPURAM, NH-5BY PASS ROAD",Srinivasrao,5000,-71.5723953,43.1938516
Andhra Pradesh,Guntur,Vijaysri Cold Storage,LALPURAM,Shripal,5060,80.4494344,16.2868497
Andhra Pradesh,Guntur,Vinukonda Cold Storage Pvt Ltd,VINUKONDA TOWN MANDAL,R.Srinivasrao,6600,79.7405355,16.0498456
Andhra Pradesh,Guntur,Vyjanthi Cold Storage,"D. NO. 283/1, LALPURAM VILLAGE, GUNTUR RURAL MANDA",V Krishnamohan,7500,80.0087746,16.3905692
Andhra Pradesh,Guntur,Y.C.R. Cold Storage Pvt Ltd,MEDIKONDURU VILAGE PIDUGURALLA ROAD,Arogyam,4800,80.29895839999999,16.3466357
Andhra Pradesh,Krishna,Gayatri Cold Storages,6-62 RAYTHUPET NANDIGAMMA,Kasivisweswarao,5000,80.2901487,16.7652868
Andhra Pradesh,Krishna,Gsr Cold Storage,GOLLPUDI,Datatrsya,5000,80.5827599,16.5400016
Andhra Pradesh,Krishna,LankaCold storage,106/2 A MYLAVARAM ROAD OPP-LDA KONDAPALLY,Krishna,4200,80.84505949999999,16.7914644
Andhra Pradesh,Krishna,Lucky Cold Storage,RAYANAPADU VIJAYAADA,G Mohanrao,4000,80.5688428,16.5710275
Andhra Pradesh,Krishna,MS Yellamanchili Cold Storage P Ltd,Keesara Distt Krishna,Y S L Prasad,5000,80.3235373,16.7186661
Andhra Pradesh,Krishna,Madhavahitech Cold Storage Pvt Ltd,16-139 VINAY NAGAR AUTO NAGAR VIJAYWADA,K.Koteswarao,5500,80.6779426,16.5016969
Andhra Pradesh,Krishna,Ms Sri Sai Lakshmi Cold Storage,Keesara Distt Krishna,Sabbasani Nagalakshmi,5000,80.3235373,16.7186661
Andhra Pradesh,Krishna,Paramount Cold Storage Private Limited,Nawabpet Village Penuganchiprolu Mandal Krishna Dist,Shri Chirumamilla Ramaiah,6500,80.23167749999999,16.8195101
Andhra Pradesh,Krishna,Rasana Cold Storage,RAYANPADU ROAD PO-GOLLAPUDI,Venkateswarai,3200,80.57624729999999,16.5418979
Andhra Pradesh,Krishna,SaisagarColdstorgs,NANDIGAMA TOWN NANDIGAMA MANDAL,Haribabh,3100,80.2859096,16.7724159
Andhra Pradesh,Krishna,SphoorthisriCold storage,NH-9 KEESARA VILLKANCHI KACHERLA MANDAL,Avsvprasad,5500,77.4658481,17.6924784
Andhra Pradesh,Krishna,Sri Durga Cold Storage,Munagacherla Village Nandigama Mandal Krishna Dist,Ch Srinivasa Rao,57000,80.26204179999999,16.7952819
Andhra Pradesh,Krishna,Sridurga Cold Storage,"MUNAGACHARLA, NANDI GAMMA",Vrameshbabu,4690,80.2859096,16.7724159
Andhra Pradesh,Krishna,The Krishna Districtmilk Producers Mutually Aided,MILKP ROJECT CHITTI NAGAR VIJAYWADA,B.V.Venugopal,1000,80.59869139999999,16.5308282
Andhra Pradesh,Krishna,VasuCold Storage,BESIDE NH-9 MUNAGACHERLA VILL-NANDIGAMA MANDAL,Rameshbabu,6000,80.272293,16.7840869
Andhra Pradesh,Krishna,Vijayawada Cold Storage,SURAYAPALEMPO-GOLLAPUDI,Ravi,6500,80.5827599,16.5400016
Andhra Pradesh,Krishna,Vijaykrishna Cold Storage,"TUMMALA PALEM RAVINDRA COMPLEX 3RD FLOOR, ELURU RO",Pbapuji,5400,81.0952431,16.7106604
Andhra Pradesh,Krishna,Yelamanchili Cold Storage,KESARA NH9 KANVHADAL,Psrini,6000,77.6205846,28.7021006
Andhra Pradesh,Kurnool,Ak. Fruits,"SUREY NO 265/3, GADICIBANDA, PUNGANOOR, KOILAKUNRL",A.Krishnaiah,13,78.3161236,15.2325828
Andhra Pradesh,Kurnool,Andhara Fruits Raipiling Chambers,HARIJANAWADA NANDYAL,Abdulrasheed,4,78.48531249999999,15.4639375
Andhra Pradesh,Kurnool,Laxmiamrutha Cold Storage,"9-19-27-8, GANDHI NAGAR, KOTHAPETA, AYYAPPA TEMPLE",P.Ramesh,50,77.08200149999999,9.4320761
Andhra Pradesh,Kurnool,MS Karshaka Mitra Cold Storage,10 Sy No 167 2A Munagalapadu V Kurnool Dist,Smt C Maheswari Devi,8000,78.0011088,15.8592397
Andhra Pradesh,Kurnool,Mehboobmiya Abdulrasool & Sons.,GADIYARAM CENTRE,Md.Khiser,3,79.6794971,15.7699737
Andhra Pradesh,Kurnool,S.Shahinoor . S.Kalam,NANDYAL,S.Kalam,1,78.487285,15.4776876
Andhra Pradesh,Kurnool,Sr Cold Storage,"D.S.P. BUNGALOW, ESI HOSPITAL, ADONI",R.Surajagarwal,80,77.27588329999999,15.6318824
Andhra Pradesh,Kurnool,Sri Venkateswara Rural Farmers Cold Storage,Allagadda Vill Mandal Kurnool Dist,Shri S V Shirisha,5000,78.5127559,15.1305389
Andhra Pradesh,Kurnool,Sv Rural Farmars Cold Storage,CHINNAKANDUKUR ROAD,S.Rajagopalreddy,10000,79.0176551,17.6016811
Andhra Pradesh,Kurnool,Taherbasha,"SHANKUNTHALA CIRCLE, EAMMIGANOOR",Mehboobbasha,4,77.4719551,15.7734175
Andhra Pradesh,Prakasam,Aditya Cold Storage,VELGATURU VILAGE PONNALURU MANDAL,Mahesh,1800,79.1718731,18.8458347
Andhra Pradesh,Prakasam,Chappidihanumanthrao Cold Storage,PAMIDIPADU ROAD RAVI NUTRHALA KORISAPADU,Veeranjaneyulu,8000,80.1078799,15.6941826
Andhra Pradesh,Prakasam,Kokila Cold Storage,NAGULUPPALAPADU VILAGE MANDAL,B.Srinivasrao,72,80.11145119999999,15.6394647
Andhra Pradesh,Prakasam,Komala Cold Storage Pvt Ltd,"INKOLLU VILAGE MANDAL, PARCHUR ROAD",Srinivasrao,6000,80.2767779,15.9684068
Andhra Pradesh,Prakasam,Latha Cold Storage,NEAR MARKET YARD ROAD ONGOLE,Sanjeevrao,5000,80.049922,15.5057232
Andhra Pradesh,Prakasam,Laxminarayana Cold Storage,PERNAMITTA VILAGE S NPADU MANDAL,Ch.Nagesh,4000,80.01157010000001,15.5284503
Andhra Pradesh,Prakasam,MS Bala Venkata Channa Cold Storage Pvt Ltd,Sy No 246 A Ganapavaram V Tripurantakam M Prakasham Dist,Shri Ramesh N,5100,79.4746284,16.0361282
Andhra Pradesh,Prakasam,MS Rythu Mithra Cold Storage,Somavarappadu V Medarametla Prakasham District,Shri Gude Panduranga Rao,5000,80.02739389999999,15.7203593
Andhra Pradesh,Prakasam,MS Sri Rama Agri Cold Storage,Pusalapadu Gram Panchay Prakasam Distt,Shri M Ramesh Babu,6940,79.0969841,15.5009017
Andhra Pradesh,Prakasam,Munagachennaiah Cold Storage,SANTANOOTALAPADU,M.V Krishnarao,8000,79.9413199,15.5425351
Andhra Pradesh,Prakasam,Omkar Cold Storage,MUKTI NUTALAPADU VILAGE,Gopichand,6000,80.2301487,15.9348116
Andhra Pradesh,Prakasam,Ongole Cold Storage Pvt Ltd,THROVAGUNTA VILAGE ONGOLE MANDAL,Rafi,7000,80.0576834,15.5522666
Andhra Pradesh,Prakasam,Parchuru Cold Storage Pvt Ltd,LNKOLLU ROAD PARCHUR VILAGE & MANDAL,Srinivasrao,5500,80.1438126,15.9279297
Andhra Pradesh,Prakasam,Raavirangaiah Cold Storage Pvt Ltd,NAGULUP PALAPADU VILAGE MANDAL,K.Srinivasrao,9000,80.11145119999999,15.6394647
Andhra Pradesh,Prakasam,Rama Cold Storage,ADDANKI VILAGE MANDAL ONGOL ROAD,G.Subbarao,5000,79.9181672,15.5652845
Andhra Pradesh,Prakasam,Sreegayatri Cold Storage,SANTHANOOTALAPADU VILAGE & MANUAL,Rammohanrao,6000,79.9413199,15.5425351
Andhra Pradesh,Prakasam,Srichandana Cold Storage Pvt Ltd,VANKAYALAPADU VILLAGE EINKOLE MANDAL PUSAPADU ADDA,G.V.R.N..Prasad,10000,80.22235959999999,15.9117451
Andhra Pradesh,Prakasam,Sridurga Cold Storage,EDUMUDI ROAD UPPUGONDURU VILAGE NAGULUPPALAPADU MA,Mohanreddy,4600,80.11145119999999,15.6394647
Andhra Pradesh,Prakasam,Srimahalaxmi Cold Storage,NH-5 THROVAGUNTA ONGOLE,B.Nagaraju,5485,80.0558551,15.55229
Andhra Pradesh,Prakasam,Srinidhi Cold Storage,PARCHOOR VILAGE MANDAL INKOLLU ROAD,K.Srinivasrao,10000,80.1438126,15.9279297
Andhra Pradesh,Prakasam,Sriramaagri Cold Storages Pvt Ltd,ONDUTLA VILAGE BEST AVARIPET MANDAL,Rameshbabu,7000,79.1026315,15.5503073
Andhra Pradesh,Prakasam,Srisaibalaji Cold Storage,LAXMIPURAM VILAGE PODILI MANDAL,J.Kumar,5000,79.6181592,15.6069505
Andhra Pradesh,Prakasam,Tulasi Cold Storage Pvt Ltd,MUKTINOOTALAPADU VILAGE ONGOLU MANDAL,Venkatrao,8000,80.049922,15.5057232
Andhra Pradesh,Prakasam,Venumadhava Cold Storage,INKOLLU VILAGE MANDAL KONIKI ROAD,S.Subbarao,8000,80.0700171,15.7875971
Andhra Pradesh,Prakasam,Yalavarthi Cold Storage,NH5 RAJUPALEM VILAGE MARTUR MANDAL,Ramesh,4500,80.1085206,16.0057834
Andhra Pradesh,Spsr Nellore,Fivestarmarineexportsprivatelimited,NARAYANA REDDY PETA,Nandakumar,5,80.05069809999999,14.4677602
Andhra Pradesh,Spsr Nellore,Saimarineexports Pvt Ltd,NARAYANA REDDY PETA,Sundaram,15,80.05069809999999,14.4677602
Andhra Pradesh,Srikakulam,SrisaiCold Storage,"M G ROAD , CHELLURU",Trinadh,3,81.9916586,16.8092991
Andhra Pradesh,Srikakulam,Vihakadary,"PLOT NO-2, EENADUPRESS, PEDAPADU",Rajasekhar,15,81.038783,16.64175
Andhra Pradesh,Visakhapatanam,MS Sri Nookambika Cold Storage,Dibba Street Gavarapalem Anakapalli V Visakhapatnam District,Shri Konatala Govinda Appala Naidu,4446,83.0129244,17.6831783
Andhra Pradesh,Visakhapatanam,VIZAG-I,"Kancherapaem,Vizag-530008",P Bharathi,36330,83.2746836,17.7343985
Andhra Pradesh,Visakhapatanam,VIZAG-II,"Near New Calltex Gate Unit 2 , Navel Base Port - 530014",D Laxamana Rao,53970,83.27735899999999,17.6785358
Assam,Chirang,Chirang Logistics Compani Private Limited,"VILL,PALASBARI,PO,KAJALGAON ,DIST,CHIRANG",Mahabir Agarwal,7500,90.6850972,26.5388578
Assam,Golaghat,Balajee Cold Storage,"EKRONIA, DERGAON",Jay Prakash,3000,93.9852916,26.6968752
Assam,Jorhat,Hanuman Spices & Herbal Pvt Ltd,"CINNAMARI, JORHAT",Partha Pratim Dutta,4000,94.2036696,26.7509207
Assam,Jorhat,Upperassam Cold Storage,"VILL,DUKLONGIA,PO,MORIANI DIST,JORHAT",Jeet Kumar,6000,94.2036696,26.7509207
Assam,Kamrup,Amul Cold Storage,RUKMANI GAON GUWAHATI,P.D Singh,100,91.79683349999999,26.1361511
Assam,Kamrup,Eden Cold Store,JAWARNAGAR KHANA PARA,Surya Ghosh,2400,91.8208179,26.121255
Assam,Kamrup,Maligaon,"Opp. N.F.Railway Headquaters,Mali Gaon , Guwahati-781011",D Dasgupta,8600,91.69064829999999,26.1437991
Assam,Kamrup,Singhimari Cold Storage,"HALO ROAD. SINGHIMARI, GUWAHATI",Kamlesh Surana,2000,91.7085933,26.1157917
Assam,Sonitpur,Suniti Prava Cold Storage,ZINGIA.SONITPUR,Srimanta Deka,5200,92.6983868,26.6769864
Assam,Tinsukia,Green Field Cold Storage,"VILL-LAIPULI ,PO-DO, PS-PANITALADIST-TINSUKIA",Manoj Kr Saha,700,95.355758,27.4885539
Assam,Tinsukia,M/S Assam Cold Storage,GANDHI PARK RD .TINSUKIA,Mihir Dutta,14000,95.355758,27.4885539
Bihar,Begusarai,BHUSARI Cold Storage PVT LTD,KORJANA,UMAKANT SINGH,2800,86.04531229999999,25.6184167
Bihar,Begusarai,HIMGANGA Cold Storage LTD,RAMJANPUR,SATYAKAM SHARMA,6000,83.45768609999999,25.477213
Bihar,Begusarai,MRIGENDRA Cold Storage,MCS[Dot]BARAUNI[At]GMAIL[Dot]COM,MRIGENDRA KUMAR,10000,87.0111932,24.9944763
Bihar,Begusarai,SUDHANSU Cold Storage PVT LTD,ULAO,CHANDRAPRAKSH MISHRA,7500,86.091184,25.4186255
Bihar,Begusarai,SWASTIK Cold Storage,ULAO,SATYANARAYAN TANTI,700,86.091184,25.4186255
Bihar,Bhagalpur,GRAMIN Cold Storage PVT LTD,SALEHPUR,SUNIL SHEKHAR,3100,77.1060464,30.26441029999999
Bihar,Bhojpur,Mohamad Lsrail Cold Storage,GIDHA BHOJPUR,Nitya Nand Prasad,7100,84.74461459999999,25.5953023
Bihar,Bhojpur,Shri GaninathBhojpur Freejing Cold Storage,GIDHA BOJPUR,Ravi Bhuson Singh,7500,84.74461459999999,25.5953023
Bihar,Bhojpur,Sushila Cold Storage,GIDHA AARA BHOJPUR,Manoj Kumar Singh,7000,84.75766999999999,25.5869149
Bihar,Buxar,Durga Cold Storage Buxar,DURGA COLD STORAGE SANDAYKETE BUXAR,Parmeshwar Rai,3750,83.9892237,25.5787256
Bihar,Darbhanga,DARBHANGA,"APMC Yard, Shiv Dhara, Darbhanga - 846004",B. B. MISHRA,6220,85.89722619999999,26.1515782
Bihar,Gaya,Chinmay Cold Store.,MANPUR. JAIPUR.,Brijnandan Passed.,2500,75.7872709,26.9124336
Bihar,Gaya,Magadh Cold Store,MAGADH COLD STORE KUJAPI GAYA,Kumar Anish Ranjan,2500,84.9803854,24.8141044
Bihar,Gaya,Prakash Cold Storage,GAYA TEKARO,Anil Kumar,4000,85.0002336,24.7913957
Bihar,Gaya,Ramble Cold Storage,MOCHARIM BODHGAYA.,Ramasrey Yadav,6000,84.9915049,24.6807426
Bihar,Gaya,Ruvi Cold Stor,MOCHARIM BODHGAYA,Ram Lakhan Parsad.,5000,84.9915049,24.6807426
Bihar,Gaya,Sri Visnu Cold Stor,AMAMA BODHGAYA,Dhirendra Parsad,3000,84.9869547,24.6961343
Bihar,Gaya,Swadesi Cold Storage,SWADESI COLDSTORAGE BHITO GAYA,Mahadev Parsad.,1650,85.0002336,24.7913957
Bihar,Gaya,Triraj Cold Store,BODH GAYA.,Ganesh Sinha.,5000,84.9869547,24.6961343
Bihar,Gopalganj,Maa Amby Agro Tek,PIPARA KHAS MIRGANJ,Ajay Ku Singh,6600,84.32227879999999,26.3798159
Bihar,Gopalganj,May Ambay Cold Storage,LINEBAZAR,Ajay Kumar,5600,84.27232149999999,26.4240437
Bihar,Gopalganj,Parbhu Cold Satorge,GOPALGANJ LANE B,Nathaniel Sing,2600,85.3177725,23.3772134
Bihar,Gopalganj,Sardar Cold Storage,SASAMUSA,Harishankar,2000,84.36079850000002,26.5250495
Bihar,Katihar,Amala Devi Cold Storage Hapla Katihar,AMALA DEVI COLD STORAGE HAPLA KATIHAR,Sarad Gaur,6900,87.5591073,25.5540648
Bihar,Katihar,Anu Shree Cold Storage Bathana Katihar,ANU SHREE COLD STORAGE BATHANA KATIHAR,Saroj Kumar,80,87.5591073,25.5540648
