STATE,DISTRICT,Storage name,Address,Manager Name,capacity,Longitude,Latitude
Rajasthan,Bikaner,Bikaner Cold Storag,PUGAL ROAD,Asok Chadak,1600,73.2866378,28.0383505
Rajasthan,Bikaner,Bisme Rabbik Sortex,F-11 KARNI INDUSRTI AREA,Najmuddin,2500,73.2942267,28.0605146
Rajasthan,Bikaner,Chttra Factory / Cold Storage,ANAND SAGAR ROAD BINASAR,Girdhari Shing,1858,74.8722246,28.2609042
Rajasthan,Bikaner,Nagarjun Cold Storage Pvt,KARNI INDUSTRIAL AREA,Raj Ghalot,1200,73.2942267,28.0605146
Rajasthan,Bikaner,Nokha Cold Storage,E-5A RIICO INDUSTRIAL AREA,Chanu Singh,2000,75.7749231,26.834803
Rajasthan,Bikaner,Parik Cold Storage,G-234 KARNI INDUATRIA AREA,Basant Kiradoo,4000,73.2942267,28.0605146
Rajasthan,Bikaner,Punrashar Interprivaz Pvt,F-441RIICO IND. AREA,Pram Prakesh,900,75.7744221,26.8344821
Rajasthan,Bikaner,Urmul Dairy,GANGANAGAR ROAD,Rk Suthar,5,73.9506892,29.8707975
Rajasthan,Dholpur,Arihant Could,RAJAKHEDA DHAULPUR,Pavan Dixit,2,78.1704986,26.8979835
Rajasthan,Ganganagar,Gurunanak Cold,RAI SINGH NAGAR,Sukhapal,2,73.447797,29.5311499
Rajasthan,Ganganagar,Janta Cold Storage,CHAK-6 PADAMPUR ROAD,Baljindar,9,73.8522849,29.9148838
Rajasthan,Ganganagar,Ms Godra Cotton Ginning And Prssing Factory,Industrial Area Alnupgarh Ganganagar,Shri Sunder Singh Bishnoi,5000,73.2046273,29.1937
Rajasthan,Ganganagar,Sri Ganganagar Cold Storage,SURATGARH ROAD,Opendra Sharma,4,73.8752967,29.8996238
Rajasthan,Hanumangarh,Ms Ratna Cold Storage,No 955 Housing Board Hanumangarh Distt,Shri Sahab Ram Poonia,5050,74.27808550000002,29.61061
Rajasthan,Hanumangarh,Ms Shubh Laxmi Foods,Ind Area RIICO PHASE I Hanumangarh Jn,Shri Rajender Kumar,2000,74.3292106,29.5821848
Rajasthan,Jaipur,Annapurna Cold Storage,"PLOT NO-E 244, ROAD, NO-13, VISHWA KARMA INDUSTRIA",Nemi Chand,25000,75.7854856,26.997294
Rajasthan,Jaipur,Annapurna Cold Storage,"F-1028-1029, PH-III, SITAPURA INDUSTRIES AREA",Manoj Tiwari,25000,75.8342467,26.7839792
Rajasthan,Jaipur,Baba Ganesh Cold Storage And Ice Factory,"F 17C, MALVIYA NAGAR INDUSTRIAL AREA",Ramji Lal Jat,4000,75.828701,26.8573126
Rajasthan,Jaipur,Gauri Enterprises Cold Storage And Ice Factory,"G-199, RIICO MANSAROVAR",Ramji Lal,12000,75.7763927,26.8318045
Rajasthan,Jaipur,Jain Arihant Cold Storage,E520A SITAPURA IND AREA,Mangal Yadav,3598,75.8513938,26.7750872
Rajasthan,Jaipur,Jain Saraogi Cold Storage P. Ltd,E 520B SITAPURA IND AREA CHITRA CIRCLE,Mangal Yadav,3665,75.8424431,26.7762431
Rajasthan,Jaipur,Jaipur Cold Storage Pvt Ltd.,MAHAPURA ROAD,Rajendra Jain,220,75.6675935,26.8457281
Rajasthan,Jaipur,Jhuramal Cold Storaga And Ice Factory,B&C 10 MALVIYA NAGAR IND. AREA,Kishan Chand,3200,77.2137844,28.5333297
Rajasthan,Jaipur,Keshav Cold Storage,RAJESHKHATUWALA[At]EMAIL[Dot]COM,Sunil Goyal,5584,86.8471395,23.7389679
Rajasthan,Jaipur,Mount Cold Storage,H 1169 SITAPURA INDUSTRIAL AREA,Laxmikant Mittal,10000,75.8342467,26.7839792
Rajasthan,Jaipur,Ms Sumit Ice Manufacture,H1 21 RIICO IND Area Mansarovar Jaipur,Shri Naresh Kumar Singhal,3200,75.77639549999999,26.8318248
Rajasthan,Jaipur,Pink City Cold Storage,OFFICE[Dot]AGRI[At]PINKCITYINDIA[Dot]COM,Devi Singh Shekhawat,4000,43.050591,39.719074
Rajasthan,Jaipur,Rachit Cold Storage,E- 699 SITAPURA INDUSTRIAL AREA,Puneet Gurjar,3000,75.8469324,26.7780408
Rajasthan,Jaipur,Ranchod Nath Cold Storage,"C-178, B-9J, ROAD NO 9 VKI",Kamal Vijayvargiya,360,75.7807187,26.9870057
Rajasthan,Jaipur,Sardarmal Cold Storage And Ice Factory,H141 MALVIYA NAGAR IND AREA,Kailash Chand Sharma,7200,77.2094473,28.5342332
Rajasthan,Jaipur,Saroj Cold Storage,145 ROAD NO. 13 JHOTWARA,Frames Sharma,2260,75.7090609,26.9636333
Rajasthan,Jaipur,Subh Laxmi Cold Storage,H11-73/74 SITAPURA IND. AREA,Vijendra Singh,5000,75.857124,26.7773541
Rajasthan,Jaipur,V.K. Cold Storage,"H-155, MALVIYA NAGAR",Manish Choudhary,2500,77.2094473,28.5342332
Rajasthan,Jaipur,Vishandas Cold Storage Pvt Ltd,ACHARAWALA NR BALAWALA STATION DIGGI ROAD,Shobraj Totlani,3380,75.7444172,26.7593577
Rajasthan,Jhalawar,Surendra,INDL. AREA JHAIRA PASTAN JHALWAR DISTT.JODHPUR,Harpal Singh,4,73.02430939999999,26.2389469
Rajasthan,Jhalawar,Surendra Ice & Cold Storage,INDL. AREA JHAIRA PASTAN JHALWAR DISTT.JODHPUR,Sanjay,2,73.02430939999999,26.2389469
Rajasthan,Jhunjhunu,Banana Raiping Could,F-17 RICCO CHIDAWA,Hakimuddin,5,75.6520522,28.2407022
Rajasthan,Jodhpur,Gotham Trading Company,A68 FALODI JODHPUR,Gotam,6,72.3700545,27.1338631
Rajasthan,Jodhpur,Paschimi Rajasthan Dudh Utpadak Sahkar Sangh Ltd,OPP-HMT BEAWAR ROAD,Sudhir Sharma,180,74.6378736,26.4341828
Rajasthan,Jodhpur,Rathi Cold Storage,B-5 RIICO INDUSTRIAL AREA,M.L RATHI,6000,75.7749231,26.834803
Rajasthan,Jodhpur,Suryanagri Cold Storage,MANDOR INDUSTRYL YERIYA,Nirmal Kumar,45,73.0443233,26.3427037
Rajasthan,Kota,Ms Aadinath AgriCold Pvt Ltd,Khasara No 421 Sandpur Th Ramganj Mandi Kota,Shri Pramod Kumar Mittal,3898,75.9666439,24.6459446
Rajasthan,Kota,Ms Om Sai Agri Facilities Pvt Ltd,Nalodiya Village Circle Julmi Road Ramganj Mandi Kota,Shri Siddharth Agrawal,5000,75.9488695,24.6344325
Rajasthan,Kota,Shanti Nath Cold Storage And Ware House,Bazar No 3 Ramganj Mandi Kota,Shri Narendra Kumar Jain,5000,75.9451464,24.6463717
Rajasthan,Kota,Suvidha Cold,RAMGANJ MANDI,Abjeet,3,75.94508119999999,24.6461795
Rajasthan,Nagaur,Laxmi Cold Storage,RIICO INDUSTIRIAL AREA,Sunil,3000,75.7763927,26.8318045
Rajasthan,Nagaur,Shrishti Cold Storage Pvt Ltd,RIICO INDUSTIRIAL AREA,Ramswarup Rathi,6000,75.7763927,26.8318045
Rajasthan,Udaipur,MS Narendra Frozen Food Store Pvt Ltd,Udyog Vihar Sukher Udaipur,Shri Rajesh Khaturia,2498,73.7182988,24.6476735
Rajasthan,Udaipur,Ms Shri Siddhi Vinayak Corporation,Plot No 1 Krishi Upaz Mandi Udaipur Dist Teh Girwa,Shri Ganesh Chandra Agrawal,1377,73.7027732,24.5564237
Rajasthan,Udaipur,Pataal Ganga Cold Storage,KIRASHI MANDI,Rahul,2000,76.9320104,31.7087153
Rajasthan,Udaipur,Same,GOVARDHAN VILLAGE,Karun Chandalia,120,72.96518990000001,19.6554842
Sikkim,North,NANGLOI,"A-9, Maha Laxmi Bldg. Shiv Ram Park, Nilothi Crossing Najafgarh Road, Nangloi Delhi � 110041",A.K.Muktawat,7442,77.0675607,28.6820444
Sikkim,North,NARELA,"DSIDC Complex, I Block Industrial Area, Near ITI., Narela, New Delhi � 110 040",N. K. Verma,17294,77.2088282,28.6139298
Sikkim,South,KIRTI NAGAR,"Warehousing Schemeblock No.2, Kirti Nagar, New Delhi 110 015",Amar Singh,26879,77.1457614,28.6589251
Sikkim,South,NAJAFGARH,"Plot No. 1, Gopal Nagar Surekhpur Morh, Block-B Near Anaj Mandi, Najafgarh, Delhi � 110 043",D.B.Ranga,2376,77.10249019999999,28.7040592
Sikkim,South,OKHLA-I,"F-82, Okhla Industrial Area, Phase-I, Part-I New Delhi � 110 020",Y.P. Dhall,6166,77.2753728,28.5388479
Sikkim,South,Okhla-Ll,"Plot No. B-13 To 15, Okhla Industrialarea, Ph. I New Delhi �110020",V.K.Gupta,10500,77.281947,28.5142139
Tamil Nadu,Chennai,AMBATTUR,"PIot.No .21/B (NP) Sidco Industrial Estate, Ambattur, Chennai - 600098",R.Subbarayan,6098,80.1721613,13.1054624
Tamil Nadu,Chennai,KALMANDAPAM,"85 Suryanarayana Chetty Street, Kalmandapam, Chennai - 600 013",S.Nagalingam,6740,80.2704622,13.0843007
Tamil Nadu,Chennai,ROYAPURAM CFS,"�Container Freight Statrion ,131,Shaikmaistry Street,Royapuram ,Chennnai-600013",R Panneerselvam,5000,80.2944637,13.1138424
Tamil Nadu,Chennai,TOLGATE,"No.783/8,T.H. Road, Sathangadu Salai,New Washermenpet,Chennai - 600 081",T.Asokan,6417,80.2933872,13.1354163
Tamil Nadu,Chennai,VIRUGAMBAKAM/CFS,"�Container Freight Station ,Arcot Road ,Virugambakkam Chennai-600092",L Stephen,74105,80.1922278,13.0532086
Tamil Nadu,Coimbatore,M.S Cold Storage,ANNOOR MAIN ROAD JADAYAMPALAYAM POST METTUPALAYAM,S.K.Mohammed Safiullah,12000,76.9435103,11.2992381
Tamil Nadu,Dharmapuri,DSA Cold Storage Private Limited,New Colony Rs Mosque Backside Dharmapuri,Shri D S Akbal,6000,78.1582143,12.1210997
Tamil Nadu,Dharmapuri,New Vennila Cold Storage,"117A, JETTIHALLI, DHARMAPURI",Saravanan,3188,78.1582143,12.1210997
Tamil Nadu,Dharmapuri,Vennila Cold Storage,SRFDHARMAPURI[At]EMAIL[Dot]COM,Saravanan,2500,78.1582143,12.1210997
Tamil Nadu,Dindigul,Sri Saravana Cold Storage,5/99-G NATHAM ROAD KOOVAUTHU POST DINDIUGAL,K.Periyasamy,4000,78.1058669,10.2636677
Tamil Nadu,Erode,Thirumuruga Cold Storage,"Plot No--2, SIPCOT Industrial Centre, Perundurai, Erode Dt",V.K.Velsamy,5000,77.2864879,11.5165278
Tamil Nadu,Krishnagiri,A S A Cold Storage,BANGALORE ROAD AMEER ESTATE AZAD NAGAR KRISHNAGIRI,Syed Nazer,4000,78.2149575,12.5265661
Tamil Nadu,Krishnagiri,Brothers Cold Storage,2/190 BANGALORE ROAD OPPOSITE COLLECTOR OFFICE KRI,Aejaz Ahmed,2000,77.4899937,13.7733562
Tamil Nadu,Krishnagiri,R R Cold Storage,KATTINAYANA PALLI ROAD VARATN APALI ROAD KRISHNAG,K Ravichandran,4000,78.2491198,12.5348538
Tamil Nadu,Madurai,ADR Cold Storage,PLOT NO D-24 SIDCO INDUSTRIAL ESTATE KAPPALUR MADU,Ganeshpandi,2327,78.03380779999999,9.8358791
Tamil Nadu,Pondicherry,PUDUCHERY,"74, Kallarai Road Vanarapet, Pondicherry - 605001",T.Rajan,7350,79.8268729,11.9297212
Tamil Nadu,Salem,Rajvignesh Cold Storage Ltd,GUDDALORE VILLAGE MAGUDANCHAVADI POST SANKARITALUK,J.Prabu,2600,77.9881401,11.5494432
Tamil Nadu,Salem,SRI KRISHNA Cold Storage,"S.No-10/3,4,5, Paranattamangalam, Salem",Ramachandran,4051,78.1460142,11.664325
Tamil Nadu,Salem,Sri Selvi Cold Storage,81/6 C KANAKAGIRI VILLAGE KAKAPALAYAM SALEM,A.Sureshkumar,2000,78.0095493,11.5573163
Tamil Nadu,Thanjavur,ANNAPOORNI Cold Storages PVT,"Thennur Village, Kumbakonaum Tk, Tanjore Dt",Thiyagaraja Kumar,2700,79.13782739999999,10.7869994
Tamil Nadu,Theni,Sri Andal Theni Banana,MUTHULAPUTAM ROAD K.KKULAM CHLNNAMANAR THENI,Natesan,100,77.4735441,10.0079322
Tamil Nadu,Theni,Sri.R.Ganesan Cold Storage Private Ltd,NEAR COLLECTOR OFFICE NH49 MADURAI ROAD KARUVELNAY,E.Pandiyan,3000,78.1197754,9.9252007
Tamil Nadu,Thiruvallur,St Peter Paul Seafood Exports,"90,Kanigaipair Village,Oothukottai Taluk",Joseph Jagan,804,79.8917246,13.3338664
Telangana,Khammam,MS Sree Ganesh Cold Storage,Madhira Revenue V Madhira M Khammam District,Shri Kalyanapu Rama Krishna,5000,80.36179899999999,16.9243152
Telangana,Khammam,Ms Anjali Agri Cold Storage Pvt Ltd,Koyachalaka Revenue Village Khammam District,Shri Jagan Mohan Rao Boppana,7000,80.1819268,17.3264713
Telangana,Khammam,Ms Aruna Sri Cold Storage,Dendukuru Village Khammam District,Shri M Koteswara Rao,8000,80.40065659999999,16.8885752
Telangana,Khammam,Ms Devi Sai Cold Storage,Atkuru Nadhira Mandalam Khammam District,Smt P Laxmi Kumari,5000,80.36323139999999,16.9181802
Telangana,Khammam,Ms Raghavendra Sai Sree Cold Storage Pvt Ltd,M V Palem Khammam Rural Khammam,Shri Ch Yadaiah,10000,80.1093805,17.2437654
Telangana,Khammam,Ms Sree Ganesh Cold Storage,Mudigonda Vill M Khammam District,Shri M Nageswara Rao,7000,80.091321,17.1819008
Telangana,Khammam,Sri Amrutha Cold Storage,Vill Krishnapuram Taluk Madhira Mandal Khammam,Shri Saichand Cherukuri,6750,80.36760490000002,16.9691305
Telangana,Medak,MS Jai Jawan Cold Storage,Sy No 52 Jandupalli V Toopran M Medak District,Shri Jam Jam Dinesh,2200,78.47716270000001,17.8411095
Telangana,Medak,MS S S Agrotech Cold Storage,Manoharabad V Toopran M Medak District,Shri V Raja Reddy,7000,78.46809019999999,17.7664207
Telangana,Medak,Ms Safe Cool Agro Tech,Muppireddypalli Tupran Mandal Medak District,M Prakash Reddy,5000,78.49224269999999,17.7255723
Telangana,Nizamabad,Ms Sri Laxmi H Tech Cold Storage,Khanapur V Nizamabad District,Shri Pasupunuri Krishna,5700,78.0794561,18.6954637
Telangana,Ranga Reddy,CFS KUKATPALLY,"IDPL Raod , Balanagar, Township Post Kukatpally , Hyderabad-500037",A V Rao,28598,78.4352235,17.4899635
Telangana,Ranga Reddy,Gubba Green Cold Pvt Ltd,Athavelli Ranga Reddy Dist,Shri Gubba Kiran Kumar,10000,78.5505481,17.1999602
Telangana,Ranga Reddy,MS Bharathi Seeds Private Limited,Sy No 693 A B And 686 Nuthankal V Medchal M Ranga Reddy District,Shri P Brahmananada Reddy,5000,78.48048279999999,17.6323358
Telangana,Ranga Reddy,MS Jai Santoshima Cold Storage,Mogullavampu V Yacharam M Ranga Reddy District,Shri M Sreenivas,1544,78.6540576,17.0388719
Telangana,Ranga Reddy,MS Jam Jam Cold Storage Agor PLC,Sy No 27 A Yellampet V Medchal M Ranga Reddy District,Ms Jam Jam Hemalatha,6000,78.48048279999999,17.6323358
Telangana,Ranga Reddy,MS VLN Cold Storage,Nuthankal Village Ranga Reddy Dist,Shri K Srinivas,9000,79.6955303,17.3321865
Telangana,Ranga Reddy,Ms Cold Space Agrotech India Pvt Ltd,Sy No 46 Rajabollaram V Medchal M Ranga Reddy Dist,Ch V Narsimha Raju,5440,78.53698059999999,17.6356439
Telangana,Ranga Reddy,Ms Nirmala Cold Care,Koheda Ranga Reddy District,Shri G Dayakar Reddy,5600,78.6359562,17.2823888
Telangana,Ranga Reddy,NACHARAM (MAULALI),"Hyderabad Roller Floor Mill Co.Ltd.Behind, Nacharam Telephone Exchange, Nacharam,Hyd-500 076",C. Dasson,7593,78.5665583,17.444206
Telangana,Ranga Reddy,SANATHNGR-FLYOVER,"Sanathnagar Flyover PO Sanathnagar Indl, Estate,Hyd-500 018",K.P.Shetty,12846,78.4061519,17.4546338
Tripura,Khowai,Teliamura 500 Mt Cap Cold Storage,TELIAMURA COLDSTORAGE GAMAIBARI KHOWAI,Swapan Devnath,500,91.6428238,23.8250226
Uttar Pradesh,Agra,55 Agra,GREEN STAR ICE COLD STORA HATH RAS ROAD,Harikesh Dubey,15000,78.0492265,27.5980718
Uttar Pradesh,Agra,Babu Lal Cold Stores Kuberpur. Nh2,BABU LAL COLD STORES KUBER PUR NH. 2,Himansu Gupta,8500,78.0974906,27.2227002
Uttar Pradesh,Agra,C.S. Cold Storage Pvt Ltd,ETAWAH ROAD JAITPUR KALAH,Vishal Jain,740,79.027659,26.7829103
Uttar Pradesh,Agra,Chaudhry Vikram Singh Cold Storage Pvt Ltd,FATEHPUR SIKRI ROAD KAORAI,Veerendra Kumar Jain,12500,77.7251979,27.1180244
Uttar Pradesh,Agra,Gaurang Cold Storage,FATEHABAD ROAD GADHI RAMPAL SHAMSHABAD,Vishnu Sharma,6000,78.1728091,27.0939133
Uttar Pradesh,Agra,Gaytri Cold Storage,DAVLI ROAD MIDHAKUR,Maheshchand Sharma,6000,77.86630319999999,27.155242
Uttar Pradesh,Agra,Jai Shree Cold Stor,DADIGUSAIN DHIMSHREE SHAMSABAD,Puran Chandra,7500,78.1849427,27.0205577
Uttar Pradesh,Agra,Maa Rajeswari Ice And Cold Storage Pvt Ltd,KHERAGARH ROAD KAGARAUL,C.P Singh Parmar,7600,77.847194,27.0213128
Uttar Pradesh,Agra,Navratan Ice And Cold Storage Pvt Ltd,FATEHABAD ROAD JAARAULI SHAMSHABAD,Ajay Jain,550,78.1728091,27.0939133
Uttar Pradesh,Agra,Nitin Rajiv Ice And Cold Storage Pvt Ltd,JAGNER ROAD NAUNI,Rambabu Upadhyay,8000,77.1729605,30.859959
Uttar Pradesh,Agra,Om Chahar Ice And Cold Storage Pvt Ltd,FATEHPUR SIKRI ROAD KIRAWLI,Bunti Sisondhiya,11085,77.786244,27.1394265
Uttar Pradesh,Agra,Om Shanti Cold Storage,SHAMSHABAD,Narendra Kumar,800,78.387971,17.2619301
Uttar Pradesh,Agra,Same,O.P. ICE AND COLD storage FAUONDRI,Saber Ali,11085.3,78.04635999999999,27.225496
Uttar Pradesh,Agra,Shree Govind Sheetgrah Pvt Ltd,KIRAWLI ROAD MAHUVAR,Shiv Singh,11500,72.88949579999999,21.0238338
Uttar Pradesh,Agra,Shri Durga Ice And Cold Storage,DUNGARWALA ROAD KHAIRAGARH,Akhilesh Kumar,5000,80.9809083,21.4182572
Uttar Pradesh,Agra,Shri Roshanlal Ice And Cold Storage,SAINYA ROAD MAHUVAKHEDA KHERAGARH,Maheshchand,6000,77.819014,26.9425734
Uttar Pradesh,Agra,Sree Bankebihari Ice And Cold Storage Pvt Ltd,FATEHPUR ROAD MIDHAKUR,Rajesh Goyal,15394.7,77.86630319999999,27.155242
Uttar Pradesh,Agra,Tomar Ice And Cold Stor,BAKALPUR SAMSABAD ROAD,D.D.Sharma,8500,78.0435622,27.1433717
Uttar Pradesh,Aligarh,Adishakti Ice & Cold Storage,MAHUA ROAD IGLAS,Vijay Pratap,12316.2,77.93674089999999,27.7080526
Uttar Pradesh,Aligarh,Ajit,PALWAL ROAD,Shiv Kumar,5084,77.3922131,28.179719
Uttar Pradesh,Aligarh,Atishay Ice & Cold Storage,TALANAGRI HARDUGANJ,Ajay Kumar,5166,78.1364889,27.9333588
Uttar Pradesh,Aligarh,Atrouli Ice & Cold Storage,STATION ROAD ATROULI,Dharmpal Singh,4800,78.285805,28.0305378
Uttar Pradesh,Aligarh,B. L. Narayan Ice & Cold Storage (P) Ltd.,V. TEHRA THE. IGLAS ALIGARH,Suresh. Chand,12750,77.9099607,27.9037408
Uttar Pradesh,Aligarh,Bal Bhadra Ice & Cold Storage Pvt. Lmt,NAVA NAGAR IGLAS ALIGARH,M.R Sharma,12700,77.9599449,27.7386064
Uttar Pradesh,Aligarh,Bawa Ice & Cold Storage P. Lmt.,GT ROAD PANETHI NEAR MAHAK HOTEL ALIGARH,Rajeshpal Singh,1200,78.1195974,27.8659065
Uttar Pradesh,Aligarh,Brajbhoomi Cold Storage,KUA GAON GONDA ROAD IGLAS,B.D. Sharma,8000,77.9403665,27.7094594
Uttar Pradesh,Aligarh,Dharnidharn Cold Storage & Ice Factory,BESWA ALIGARH,Ratan Singh,5000,77.86959960000002,27.6400446
Uttar Pradesh,Aligarh,G.G. Cold Storage And Ice Factory,SEVANPUA GONDA ROAD IGLAS,Omkar Singh,20000,77.8408031,27.7542379
Uttar Pradesh,Aligarh,Jyoti Cold Storage,GRAM GAHLAU GONDA ROAD IGLAD,Sushil Kumar,5750,77.9103178,27.7771764
Uttar Pradesh,Aligarh,K. K. Ice & Cold Storage,NAVANAGAR IGLAS,Sanjay Singh,7636,77.9599449,27.7386064
Uttar Pradesh,Aligarh,Kanahaiya Sheet Grah,TEHRA IGLAS,Manoj Choudhri,79,77.93674089999999,27.7080526
Uttar Pradesh,Aligarh,Lagsama Ka Sheet Grah,SEVEMPUR IGLAS GONDA ROAD,Omkar Singh,10700,77.8408031,27.7542379
Uttar Pradesh,Aligarh,Lakshya Ice & Cold Storage,NAVANAGAR IGLAS,Neeraj Agarwal,11506.6,77.9599449,27.7386064
Uttar Pradesh,Aligarh,Maa Bhagwati Ice & Cold Storage Pvt. Lmt.,NAVANAGAR IGLAS ALIGARH,Sanjay Singh,600,77.9599449,27.7386064
Uttar Pradesh,Aligarh,Maa Chamunda Devi Cold Storage,VILL BESWA IGLASH GORE ROAD,Mohin Khan,2,77.93674089999999,27.7080526
Uttar Pradesh,Aligarh,Maa Vaisno Ice & Cold Storage,SAHARANPUR IGLAS,Sanjay Singh,9000,77.55520659999999,29.9680035
Uttar Pradesh,Aligarh,Munnilal Cold Storage,ALIGARH MATHURA ROAD IGLAS,Alin Kumar Pandey,12000,77.9384491,27.7066892
Uttar Pradesh,Aligarh,Nishant Cold Storage,ALIGARH IGLAS ROAD,Naveen Gupta,9367,78.0094093,27.7047923
Uttar Pradesh,Aligarh,Rama Agro & Allied Industries,G.T ROAD SOOTMEEL,Manjeet Singh,1750,74.2390965,31.8847743
Uttar Pradesh,Aligarh,Rishal Ice & Cold Storage,SEVEMPUR IGLAS GONDA ROAD,Chandra Mohan Katara,5775,77.8408031,27.7542379
Uttar Pradesh,Aligarh,Sanjay Ice And Presarvation,SOMNA ROAD KHAIR,Arvindra,10000,77.8438774,27.9436577
Uttar Pradesh,Aligarh,Sri Balaji Ice And Cold Storage,SOMNA ROAD KHAIR,K.P. Singh,14000,77.8438774,27.9436577
Uttar Pradesh,Aligarh,Sri Tirupati Ice And Cold Storage,VILL SAHARA IGLASH ROAD,Vineet Kela,12.5,78.0083168,27.7049019
Uttar Pradesh,Aligarh,Urmila- Seema Cold Storage & Ice Factory,G.T. ROAD,Rajeev Yadav,9552,74.2390965,31.8847743
Uttar Pradesh,Aligarh,Vidhya Devi Cold Storage Pvt Lmt,ROAD SADABAAD,Dilip Kumar Gautam,580,78.03380779999999,27.439091
Uttar Pradesh,Aligarh,Vishwamitrapuri Cold Storage Pvt Lmt.,BESHWA IGLAS GONDA ROAD,Sudarshan Gautam,10000,77.93674089999999,27.7080526
Uttar Pradesh,Aligarh,Yashpal Agri Products & Sheetgrah Put. Ltd.,KAREKA IGLAS,Azad Khan,7500,77.93674089999999,27.7080526
Uttar Pradesh,Allahabad,Abhishek Cold,FAFAMAU ROOD,Vidya Kant,12500,81.8537532,25.5341192
Uttar Pradesh,Allahabad,Adarsh Cold Storage,MALAK HARHAR ALLAHABAD,Mo Anwar,8000,81.82457389999999,25.5319494
Uttar Pradesh,Allahabad,BHOLA SINGH Cold STORES,BHOLA SINGH COLD STORES NEAR ALLAHABAD TO FAIZABAD,RAMJEET SINGH,10000,81.846311,25.4358011
Uttar Pradesh,Allahabad,Baba Cold Storage,BABA COLD STORAGE HARIPUR BINDA SAID BAD ASEIPUR A,09453709640 Manoj Kumar,6000,72.9106202,33.9946466
Uttar Pradesh,Allahabad,Bola Sheet Ghar Sahson,BHOLA SHEET GHAR SAHSON ALLHABAD,Bishwamber Dutt Pant,12500,81.98048159999999,25.4848216
Uttar Pradesh,Allahabad,Doaba Cold Storage & Ice Factory,IBRAHIMPUR BAMRAULI MANDAR ALLAHABAD,Baiju Lal,3300,81.74256940000001,25.4442445
Uttar Pradesh,Allahabad,Doaba Sheetgarh,MEERA PATTI MUNDHERA ALLAHABAD,Sunil,6150,81.7621369,25.4476713
Uttar Pradesh,Allahabad,FARUKHABAD Cold STORES,2/SILAKHANA TEALIYARGANJ ALLAHABAD,MANOJ SEXEENA,12300,81.846311,25.4358011
Uttar Pradesh,Allahabad,Guru Nanak Sheetgarh,SOUTH ROAD SIVIL LINE ALLAHABAD,Jagjeet Singh,2250,81.8283043,25.448332
Uttar Pradesh,Allahabad,Handia Cold Storage,HANDIA COLD STORAGE HANDIA ALLHABAD UP,Mushtaq Ahmad,5000,82.1883264,25.3773371
Uttar Pradesh,Allahabad,KRISNA Cold STORE FAFAMAU GADOOPUR,ALLAHABAD TO FAIZABAD ROAD IN SIDE,RAMRAJ,7500,81.846311,25.4358011
Uttar Pradesh,Allahabad,Kesarwami Sheetalaya,KESARWNI SHEETALAYA ASORAON ALLHABAD,Ram Abhelas Devedi,12500,81.9742855,25.4825977
Uttar Pradesh,Allahabad,Kesarwni Sheetalaya Sahso Allhabad,KESARWNISHEETALAYA SAHSO ALLHABAD,SuchilSarma,8750,81.98048159999999,25.4848216
Uttar Pradesh,Allahabad,Lehti Cold,LEHATI,Thakur Prashad,7800,87.2131071,24.8207864
Uttar Pradesh,Allahabad,Mohan Cold Storage,MOHAN COLD STORAGE TIKARI NAWAB GANJ ALLHABAD,Sri Ashish Kumar,5000,81.846311,25.4358011
Uttar Pradesh,Allahabad,Pancham Cold Storage And Ice Company Soraon A,PANCHAM COLD ATORAGE SORAON ALLHANAD,Ram Abhilash Tiwari,4100,81.8497567,25.6070169
Uttar Pradesh,Allahabad,Prasont Kumar & Prashant Kumar Sheetgrah,AJAD NAGAR GOHRI ROAD FAFAMAU ALLAHABAD,Shri Manish Nand Ojha,9000,81.8520059,25.557887
Uttar Pradesh,Allahabad,R.B. S SEETALAYA,R.B.S SEETALYA MEAJA ROAD ALLAHABAD,SHIV NARAYAN,4500,82.088222,25.20374
Uttar Pradesh,Allahabad,Rajendra Cold Storage,MAHAWAR DARI ALLAHABAD,Ravi Prakash Agrawal,1100,81.846311,25.4358011
Uttar Pradesh,Allahabad,Ram Kirisn Cold,180 HIMAT GANJ,Sandip,665,81.84565930000001,25.4348045
Uttar Pradesh,Allahabad,SUBEDAR Cold STORE GADOOPUR,FAIZABAD TO ALLAHABAD ROAD NEAR,MD.ALIM,5000,82.1457934,26.7729751
Uttar Pradesh,Allahabad,Sagar Cold Storage & Ice Factoru,SHULTANPUR KHASH MAUAMA,Mo Alam,5000,81.8852582,25.7059716
Uttar Pradesh,Allahabad,Saine Sheetalaya & Ice Factory Tikari NawbGanj Allh,SAINE SHEETALAYA TIKARI NAWB GANJ ALLHABAD,Sri Anup Singh,3690.7,81.846311,25.4358011
Uttar Pradesh,Allahabad,Shakeet Seetalaya & Ice Factory,SHAKET SEETALAYA &ICE FACTORY GADOPUR PHAPHA MAU A,Sri Ram Geet Singh,12300,81.84565930000001,25.534773
Uttar Pradesh,Allahabad,Shard Sheetalaya Dharoli,SHARD SHEETALAYA DHAROLI HANMANGANJ ALLHABAD,Hriday Nand Singh,3936,81.9786972,25.483163
Uttar Pradesh,Allahabad,Shri Krishna Cold Storage,SHRI KIRSHNA COLD STORAGE GADOPUR PHAPHAMAU ALLHAB,Sri Ram Raj,7500,81.8452555,25.5309063
Uttar Pradesh,Amethi,Ms Shree Sai Cold Storage,Village Goriabad Pargana Gaura Jamo District Amethi,Shri Dinesh Jaykaran Tiwari,5294,81.6665149,26.4034733
Uttar Pradesh,Auraiya,Badrinarayan Cold Storage,BELAROAD ASANI DIVYAPUR AURAIYA,Ram Kishor Tiwari,3882.88,79.5569905,26.6432519
Uttar Pradesh,Auraiya,Bharat Cold Storage,ASANI DIVYAPUR AURAIYA,Dewan Singh,6875,79.5638561,26.665515
Uttar Pradesh,Auraiya,M. Anuraj Sheet Griha & Industry,PATACHAURAHA FAFUD AURAIYA,Raghvendra Shukla,15400,79.4648131,26.5997918
Uttar Pradesh,Auraiya,Shree Shesh Sheet Griha,ANANAT RAM SONASI AURAIYA,Bharat Bahadauriya,8400,79.2585058,26.603316
Uttar Pradesh,Auraiya,Shree Sundar Sheet Griha,BABARPUR AURAIYA,Pramod Dubey,5800,79.3130972,26.5706587
Uttar Pradesh,Auraiya,Vedant Adible Products Pvt. Ltd.,MOHARI BABARPUR AURAIYA,Shiv Kumar,7000,79.2873953,26.5887602
Uttar Pradesh,Azamgarh,Murli Cold Storage & Ice Factory Azamgarh,MURLI COLD STORAGE&ICE FACTORY AZAMGARH,Sri Anil Kumar,3280,83.18594949999999,26.0739138
Uttar Pradesh,Azamgarh,RUNGTA Cold STORE,RUNGTA COLD STORE PHOOLPUR AZAMGARH,MOHANLAL,1148,82.8755209,26.0775099
Uttar Pradesh,Azamgarh,Singh Cold Storage & Ice Factory,SINGH COLD STORAGE &ICE FACTORY CAPTANGANJ AZAMGAR,Shri Angaed Singh,4200,83.0978679,26.191993
Uttar Pradesh,Azamgarh,Sri Hanuman Cold Storage,SRI HANUMAN COLD STORAGE RERAHA AHIRAWLA AZAMGARH,Sri Pannu Chauhan,1800,82.9111585,26.1814514
Uttar Pradesh,Ballia,MAHESARI Cold & ICE FACTORI,MAHESARI COLD STORE &ICE FACTORI HARKUL BALLIA,MURLIDHAR,2214,74.99247199999999,30.8499164
Uttar Pradesh,Ballia,MODRAN Cold STORE,05498-23608,RAJNATH,4264,-76.5372625,37.1541965
Uttar Pradesh,Ballia,Purvanchal Cold Storage,PIRVANCHAL COD STORAGE MANEYARA BALLIA,Sri Ram Chorasiya,2132,84.1857115,25.8307174
Uttar Pradesh,Ballia,Sarbgeet Cold Storage,DAROBAAS DEHA BALLIA,Sri Markandy Singh,15000,79.3651914,28.2006882
Uttar Pradesh,Ballia,Shivam Cold Storage,SONBARSH BAIRIYA BALIYA,Bachcha Lal Prajapati,11250,84.5064881,25.7311255
Uttar Pradesh,Ballia,Soreha Cold Storage,SOREHA COD STORAGE SOREHA SHATVAR BALLIA,Sri Barmha Dev Singh,4908,79.3651914,28.2006882
Uttar Pradesh,Barabanki,C. P Cold STORES,MOHAMADPUR CHOKU SAFEADABAD BARABANKI,ASHOK SHARMA,12800,81.220968,27.0310215
Uttar Pradesh,Barabanki,CHENDEL Cold STORES,CHENDEL COLD STORES RAMNAGAR BARABANKI,DUSHYANT SINGH CHEANDEL,7100,81.4053295,27.0852199
Uttar Pradesh,Barabanki,JANTA Cold STORES,KUROLI BARABANKI,SURENDER PRATAP SINGH,8750,81.1833809,26.9268042
Uttar Pradesh,Barabanki,KUROLI Cold STORES,KUROLI BARABANKI,UMESH KUMAR,9562.53,81.1833809,26.9268042
Uttar Pradesh,Barabanki,Mashoor Cold Storage,JHASAPURWA FATEHPUR BARABANKI,Shri Brijesh Kumar Varma,5000,81.2157665,27.1742902
Uttar Pradesh,Barabanki,PARMESHWARI INDUSTRIES PVT,PALRI BARABANKI,MAHADEV SINGH,15690,81.1833809,26.9268042
Uttar Pradesh,Barabanki,Palhari Cold Storage,FAIZABADROAD,S.K.Srivastav,10200,81.7334345,26.7829456
Uttar Pradesh,Barabanki,Salarpur Cold Storage,SALARPUR FATEPUR ROAD BARABANKI,Shri Raj Kumar Varma,14200,77.3882686,28.5456897
Uttar Pradesh,Basti,Prakash Cold Storage,PLASTIC COMPLUX IND ARIYA BASTI,Shri Manoj Kumar Shriwastv,5385,82.7913767,26.807451
Uttar Pradesh,Basti,Suyash Cold Storage,MEHDAWAL RAOD AMOULI BASTI,Shri Subodh,3700,83.10851199999999,26.9761045
Uttar Pradesh,Bijnor,Jain Cold Storage & Ice Factory,KOTDWAR ROAD,Anup Jain,5000,78.5198094,29.7453031
Uttar Pradesh,Bijnor,TIRUPATI ColdSTORE,MUDIYA,RAM AVATAR,7337.07,79.2408858,28.1564169
Uttar Pradesh,Budaun,Badaun Cold Storage,PANWADI BADAUN,D.N.Tandan,5494,79.1271229,28.0311101
Uttar Pradesh,Budaun,Brij Cold Storage & Ice Factory,AJNAWAR BISAULI,Satya Pal Sharma,4884.2,78.9344814,28.2978317
Uttar Pradesh,Budaun,Chabbra Cold Storage,PANJABI COLLONY,Sri Hari Prakash,5576,73.1681503,19.2268954
Uttar Pradesh,Budaun,Ganesh Cold Storage,GANJSAHIDA UJHANI,Amit,3000,79.0051685,28.0003235
Uttar Pradesh,Budaun,Gyan Cold Storage And Ice Factory,BADAUN ROAD UJHANI,Sri Sher Singh,4500,78.979192,28.2723789
Uttar Pradesh,Budaun,Maheshwri Cold Storage,BADAUN ROAD UJHANI,Virendra Kumar Gupta,4200,78.979192,28.2723789
Uttar Pradesh,Budaun,Mahsar Singh Cold Storage,KHEDA NAVEDA BARELI ROAD BADAUN,Sri Rampal Nagar,2000,79.1271229,28.0311101
